id,user,standard_answer
qa_436,Update account currency,"If you have not yet funded your HFM account/Live trading account, please send us an email to the email address found on the Contact Us section of our website, from your registered email address with your request, specifying the base currency you wish to have on your account, and kindly confirm the account number. Please do not make any deposits until you have received confirmation that the change has been made successfully. If you have already funded your account, unfortunately, it is not possible to change the base currency."
qa_437,Reset trader password,"How to Change Your Trader's Password For Desktop: Access your myHF area from your PC or Laptop. Navigate to My Trading Accounts: In the Home tab, locate the 'My Trading Accounts' section. Select the Account: Find the Live or Demo account for which you want to change the password. Under the 'ACTIONS' tab, click the cog wheel symbol. Change Password: Choose 'Change Password' from the options. Set New Password: Enter a new password that meets all security criteria, then click 'Continue'. Verify with OTP: You will receive a two-factor authentication (2FA) one-time password (OTP) via your registered email. Enter this OTP in the provided field and click 'Confirm'. For HFM App: Open the HFM App and log in to your myHF area. Access My Wallet: Tap on the Menu and select 'My Wallet'. Select Account: Choose either the 'Live Accounts' or 'Demo Accounts' tab, then tap on the trading account for which you want to change the password. Change Password: Tap the three vertical dots next to the 'Trade' button and select 'Change Password'. Set New Password: Enter a new password that meets all security criteria, then tap 'Continue'. Verify with OTP: You will receive a two-factor authentication (2FA) one-time password (OTP) via your registered email. Enter this OTP in the provided field and click 'Confirm'."
qa_438,Change trading password,"How to Change Your Trader's Password For Desktop: Access your myHF area from your PC or Laptop. Navigate to My Trading Accounts: In the Home tab, locate the 'My Trading Accounts' section. Select the Account: Find the Live or Demo account for which you want to change the password. Under the 'ACTIONS' tab, click the cog wheel symbol. Change Password: Choose 'Change Password' from the options. Set New Password: Enter a new password that meets all security criteria, then click 'Continue'. Verify with OTP: You will receive a two-factor authentication (2FA) one-time password (OTP) via your registered email. Enter this OTP in the provided field and click 'Confirm'. For HFM App: Open the HFM App and log in to your myHF area. Access My Wallet: Tap on the Menu and select 'My Wallet'. Select Account: Choose either the 'Live Accounts' or 'Demo Accounts' tab, then tap on the trading account for which you want to change the password. Change Password: Tap the three vertical dots next to the 'Trade' button and select 'Change Password'. Set New Password: Enter a new password that meets all security criteria, then tap 'Continue'. Verify with OTP: You will receive a two-factor authentication (2FA) one-time password (OTP) via your registered email. Enter this OTP in the provided field and click 'Confirm'."
qa_439,Unsuccessful deposit error,"If you are trying to make a deposit and receive the error message Unsuccessful deposit, please contact your bank for clarification. If you still require assistance regarding your deposit, please email our Deposit Department at deposit@hfm.com"
qa_440,Cannot fund account,"If you are trying to make a deposit and receive the error message Unsuccessful deposit, please contact your bank for clarification. If you still require assistance regarding your deposit, please email our Deposit Department at deposit@hfm.com"
qa_441,Where is my deposit,"If your deposit transaction was successful but the funds have not appeared in your myHF account, please send a screenshot or any confirmation of the successful transaction to deposit@hfm.com. Our Deposit Department will assist you further. You can also check your deposit status by logging into your myHF area, selecting My Wallet on the left-hand menu, and viewing the Deposit tab to see your recent transactions. If you received an Unsuccessful deposit error, please contact your bank for clarification or reach out to us at the same email above for further help."
qa_442,Deposit not received,"If your deposit transaction was successful but the funds have not appeared in your myHF account, please send a screenshot or any confirmation of the successful transaction to deposit@hfm.com. Our Deposit Department will assist you further. You can also check your deposit status by logging into your myHF area, selecting My Wallet on the left-hand menu, and viewing the Deposit tab to see your recent transactions. If you received an Unsuccessful deposit error, please contact your bank for clarification or reach out to us at the same email above for further help."
qa_443,My deposit is missing,"If your deposit transaction was successful but the funds have not appeared in your myHF account, please send a screenshot or any confirmation of the successful transaction to deposit@hfm.com. Our Deposit Department will assist you further. You can also check your deposit status by logging into your myHF area, selecting My Wallet on the left-hand menu, and viewing the Deposit tab to see your recent transactions. If you received an Unsuccessful deposit error, please contact your bank for clarification or reach out to us at the same email above for further help."
qa_444,Deposit hasn't appeared,"If your deposit transaction was successful but the funds have not appeared in your myHF account, please send a screenshot or any confirmation of the successful transaction to deposit@hfm.com. Our Deposit Department will assist you further. You can also check your deposit status by logging into your myHF area, selecting My Wallet on the left-hand menu, and viewing the Deposit tab to see your recent transactions. If you received an Unsuccessful deposit error, please contact your bank for clarification or reach out to us at the same email above for further help."
qa_445,Deposit not showing,"If your deposit transaction was successful but the funds have not appeared in your myHF account, please send a screenshot or any confirmation of the successful transaction to deposit@hfm.com. Our Deposit Department will assist you further. You can also check your deposit status by logging into your myHF area, selecting My Wallet on the left-hand menu, and viewing the Deposit tab to see your recent transactions. If you received an Unsuccessful deposit error, please contact your bank for clarification or reach out to us at the same email above for further help."
qa_446,Funds not visible,"If your deposit transaction was successful but the funds have not appeared in your myHF account, please send a screenshot or any confirmation of the successful transaction to deposit@hfm.com. Our Deposit Department will assist you further. You can also check your deposit status by logging into your myHF area, selecting My Wallet on the left-hand menu, and viewing the Deposit tab to see your recent transactions. If you received an Unsuccessful deposit error, please contact your bank for clarification or reach out to us at the same email above for further help."
qa_447,Reactivate frozen Cent account,"A frozen or archived Cent account cannot be reactivated or recovered once it has been archived. If you have archived your Cent account, this action is permanent. You would need to open a new account if you wish to trade again. If you believe your account was frozen in error, please contact our support team for clarification."
qa_448,Recover archived account,"A frozen or archived Cent account cannot be reactivated or recovered once it has been archived. If you have archived your Cent account, this action is permanent. You would need to open a new account if you wish to trade again. If you believe your account was frozen in error, please contact our support team for clarification."
qa_449,Can I register from my country,"We offer services in many countries, which you can see by visiting our registration page and clicking 'Register.' If your country of residence is not an option, it means we don't service your region at this time. We are not able to service residents of certain jurisdictions, including the USA, Canada, Sudan, Syria, Iran, and North Korea. You can start registering from our website by clicking 'Register.'"
qa_450,Is my country supported,"We offer services in many countries, which you can see by visiting our registration page and clicking 'Register.' If your country of residence is not an option, it means we don't service your region at this time. We are not able to service residents of certain jurisdictions, including the USA, Canada, Sudan, Syria, Iran, and North Korea. You can start registering from our website by clicking 'Register.'"
qa_451,I am from Austria can I register,"We offer services in many countries, which you can see by visiting our registration page and clicking 'Register.' If your country of residence is not an option, it means we don't service your region at this time. We are not able to service residents of certain jurisdictions, including the USA, Canada, Sudan, Syria, Iran, and North Korea. You can start registering from our website by clicking 'Register.'"
qa_452,Can I open account from my country,"We offer services in many countries, which you can see by visiting our registration page and clicking 'Register.' If your country of residence is not an option, it means we don't service your region at this time. We are not able to service residents of certain jurisdictions, including the USA, Canada, Sudan, Syria, Iran, and North Korea. You can start registering from our website by clicking 'Register.'"
qa_453,Country availability,"We offer services in many countries, which you can see by visiting our registration page and clicking 'Register.' If your country of residence is not an option, it means we don't service your region at this time. We are not able to service residents of certain jurisdictions, including the USA, Canada, Sudan, Syria, Iran, and North Korea. You can start registering from our website by clicking 'Register.'"
qa_454,I am from Australia can I register,"We offer services in many countries, which you can see by visiting our registration page and clicking 'Register.' If your country of residence is not an option, it means we don't service your region at this time. We are not able to service residents of certain jurisdictions, including the USA, Canada, Sudan, Syria, Iran, and North Korea. You can start registering from our website by clicking 'Register.'"
qa_455,I am from Europe can I register,"We offer services in many countries, which you can see by visiting our registration page and clicking 'Register.' If your country of residence is not an option, it means we don't service your region at this time. We are not able to service residents of certain jurisdictions, including the USA, Canada, Sudan, Syria, Iran, and North Korea. You can start registering from our website by clicking 'Register.'"
qa_456,Europe registration,"We offer services in many countries, which you can see by visiting our registration page and clicking 'Register.' If your country of residence is not an option, it means we don't service your region at this time. We are not able to service residents of certain jurisdictions, including the USA, Canada, Sudan, Syria, Iran, and North Korea. You can start registering from our website by clicking 'Register.'"
qa_457,I am from UK can I register,"We offer services in many countries, which you can see by visiting our registration page and clicking 'Register.' If your country of residence is not an option, it means we don't service your region at this time. We are not able to service residents of certain jurisdictions, including the USA, Canada, Sudan, Syria, Iran, and North Korea. You can start registering from our website by clicking 'Register.'"
qa_458,United Kingdom registration,"We offer services in many countries, which you can see by visiting our registration page and clicking 'Register.' If your country of residence is not an option, it means we don't service your region at this time. We are not able to service residents of certain jurisdictions, including the USA, Canada, Sudan, Syria, Iran, and North Korea. You can start registering from our website by clicking 'Register.'"
qa_459,I am from UAE can I register,"We offer services in many countries, which you can see by visiting our registration page and clicking 'Register.' If your country of residence is not an option, it means we don't service your region at this time. We are not able to service residents of certain jurisdictions, including the USA, Canada, Sudan, Syria, Iran, and North Korea. You can start registering from our website by clicking 'Register.'"
qa_460,UAE registration,"We offer services in many countries, which you can see by visiting our registration page and clicking 'Register.' If your country of residence is not an option, it means we don't service your region at this time. We are not able to service residents of certain jurisdictions, including the USA, Canada, Sudan, Syria, Iran, and North Korea. You can start registering from our website by clicking 'Register.'"
qa_461,I am from Poland can I register,"We offer services in many countries, which you can see by visiting our registration page and clicking 'Register.' If your country of residence is not an option, it means we don't service your region at this time. We are not able to service residents of certain jurisdictions, including the USA, Canada, Sudan, Syria, Iran, and North Korea. You can start registering from our website by clicking 'Register.'"
qa_462,Poland registration,"We offer services in many countries, which you can see by visiting our registration page and clicking 'Register.' If your country of residence is not an option, it means we don't service your region at this time. We are not able to service residents of certain jurisdictions, including the USA, Canada, Sudan, Syria, Iran, and North Korea. You can start registering from our website by clicking 'Register.'"
qa_463,I am from Greece can I register,"We offer services in many countries, which you can see by visiting our registration page and clicking 'Register.' If your country of residence is not an option, it means we don't service your region at this time. We are not able to service residents of certain jurisdictions, including the USA, Canada, Sudan, Syria, Iran, and North Korea. You can start registering from our website by clicking 'Register.'"
qa_464,Greece registration,"We offer services in many countries, which you can see by visiting our registration page and clicking 'Register.' If your country of residence is not an option, it means we don't service your region at this time. We are not able to service residents of certain jurisdictions, including the USA, Canada, Sudan, Syria, Iran, and North Korea. You can start registering from our website by clicking 'Register.'"
qa_465,I am from Mauritius can I register,"We offer services in many countries, which you can see by visiting our registration page and clicking 'Register.' If your country of residence is not an option, it means we don't service your region at this time. We are not able to service residents of certain jurisdictions, including the USA, Canada, Sudan, Syria, Iran, and North Korea. You can start registering from our website by clicking 'Register.'"
qa_466,Mauritius registration,"We offer services in many countries, which you can see by visiting our registration page and clicking 'Register.' If your country of residence is not an option, it means we don't service your region at this time. We are not able to service residents of certain jurisdictions, including the USA, Canada, Sudan, Syria, Iran, and North Korea. You can start registering from our website by clicking 'Register.'"
qa_467,I am from Seychelles can I register,"We offer services in many countries, which you can see by visiting our registration page and clicking 'Register.' If your country of residence is not an option, it means we don't service your region at this time. We are not able to service residents of certain jurisdictions, including the USA, Canada, Sudan, Syria, Iran, and North Korea. You can start registering from our website by clicking 'Register.'"
qa_468,Seychelles registration,"We offer services in many countries, which you can see by visiting our registration page and clicking 'Register.' If your country of residence is not an option, it means we don't service your region at this time. We are not able to service residents of certain jurisdictions, including the USA, Canada, Sudan, Syria, Iran, and North Korea. You can start registering from our website by clicking 'Register.'"
qa_469,I am from Germany can I register,"We offer services in many countries, which you can see by visiting our registration page and clicking 'Register.' If your country of residence is not an option, it means we don't service your region at this time. We are not able to service residents of certain jurisdictions, including the USA, Canada, Sudan, Syria, Iran, and North Korea. You can start registering from our website by clicking 'Register.'"
qa_470,Germany registration,"We offer services in many countries, which you can see by visiting our registration page and clicking 'Register.' If your country of residence is not an option, it means we don't service your region at this time. We are not able to service residents of certain jurisdictions, including the USA, Canada, Sudan, Syria, Iran, and North Korea. You can start registering from our website by clicking 'Register.'"
qa_471,Give example of correct password,"A correct password should meet all security criteria, which typically include: A mix of uppercase and lowercase letters, at least one number, at least one special character (e.g., !, @, #, $), and minimum length of 8 characters or more. For example: StrongPass123! When creating your password, make sure it follows these rules to ensure your account security."
qa_472,Password example,"A correct password should meet all security criteria, which typically include: A mix of uppercase and lowercase letters, at least one number, at least one special character (e.g., !, @, #, $), and minimum length of 8 characters or more. For example: StrongPass123! When creating your password, make sure it follows these rules to ensure your account security."
qa_473,Why is my password rejected,"Your password might be rejected if it does not meet the required security criteria. When changing your trader's password, make sure it meets all security requirements (such as length, use of uppercase/lowercase letters, numbers, and special characters), is entered correctly without typos, and matches the confirmation password field. If you are changing your password via the myHF area or the HFM App, you will also need to verify the change by entering a one-time password (OTP) sent to your registered email. Ensure you enter the OTP correctly to complete the process. If you continue to experience issues, please contact our support team for assistance."
qa_474,Password being objected,"Your password might be rejected if it does not meet the required security criteria. When changing your trader's password, make sure it meets all security requirements (such as length, use of uppercase/lowercase letters, numbers, and special characters), is entered correctly without typos, and matches the confirmation password field. If you are changing your password via the myHF area or the HFM App, you will also need to verify the change by entering a one-time password (OTP) sent to your registered email. Ensure you enter the OTP correctly to complete the process. If you continue to experience issues, please contact our support team for assistance."
qa_475,Transfer to manual customer service,We will connect you with one of our live agents to assist you.
qa_476,Manual customer service,We will connect you with one of our live agents to assist you.
qa_477,Why was my account terminated,"If your account was terminated during the verification process, this could be due to incomplete or rejected verification documents, failure to meet regulatory requirements, or other compliance issues. Please check your registered email for any notifications from our verification team explaining the reason. For specific details about your account termination and potential resolution, please contact our support team at the email address found on our Contact Us page, as they can review your case individually and provide detailed information about the termination reason."
qa_478,Account terminated during verification,"If your account was terminated during the verification process, this could be due to incomplete or rejected verification documents, failure to meet regulatory requirements, or other compliance issues. Please check your registered email for any notifications from our verification team explaining the reason. For specific details about your account termination and potential resolution, please contact our support team at the email address found on our Contact Us page, as they can review your case individually and provide detailed information about the termination reason."
qa_479,How to deactivate account,"To deactivate a trading account, you can archive it through your myHF area. On Desktop: Log in to myHF area, find your account under 'My Trading Accounts', click the cog wheel under 'ACTIONS', and select 'Archive Account'. On HFM App: Go to Menu > My Wallet, select your account, tap the three dots next to 'Trade', and tap 'Archive Account'. Important: Once archived, the account cannot be reactivated. If you want to close your entire HFM account, first withdraw all funds, then email us from your registered address via our Contact Us page confirming your request and reason for closure."
qa_480,Deactivate my trading account,"To deactivate a trading account, you can archive it through your myHF area. On Desktop: Log in to myHF area, find your account under 'My Trading Accounts', click the cog wheel under 'ACTIONS', and select 'Archive Account'. On HFM App: Go to Menu > My Wallet, select your account, tap the three dots next to 'Trade', and tap 'Archive Account'. Important: Once archived, the account cannot be reactivated. If you want to close your entire HFM account, first withdraw all funds, then email us from your registered address via our Contact Us page confirming your request and reason for closure."
qa_481,Market Watch disappeared,"To restore the Market Watch screen in your trading terminal: Right-click on the Market Watch window, select 'Symbols' and choose the instruments you want to trade, click 'Show', then close the Market Watch window. Right-click again on Market Watch and select 'Show All'. If you see greyed-out symbols, you can right-click and select 'Hide' to remove them. If you continue to have issues with your trading platform, please contact our Live Agents for technical assistance."
qa_482,Market Watch screen missing,"To restore the Market Watch screen in your trading terminal: Right-click on the Market Watch window, select 'Symbols' and choose the instruments you want to trade, click 'Show', then close the Market Watch window. Right-click again on Market Watch and select 'Show All'. If you see greyed-out symbols, you can right-click and select 'Hide' to remove them. If you continue to have issues with your trading platform, please contact our Live Agents for technical assistance."
qa_483,Nawala ang market screen,"Para maibalik ang screen ng Market Watch sa inyong trading terminal: I-right click ang Market Watch window, piliin ang 'Symbols' at piliin ang mga instrumento na gusto ninyong i-trade, i-click ang 'Show', pagkatapos isara ang Market Watch window. I-right click muli ang Market Watch at piliin ang 'Show All'. Kung may mga greyed-out na simbolo, maaari ninyong i-right click at piliin ang 'Hide'. Kung patuloy pa rin ang problema sa inyong trading platform, makipag-ugnayan sa aming Live Agents para sa technical assistance."
qa_484,Market screen nawala,"Para maibalik ang screen ng Market Watch sa inyong trading terminal: I-right click ang Market Watch window, piliin ang 'Symbols' at piliin ang mga instrumento na gusto ninyong i-trade, i-click ang 'Show', pagkatapos isara ang Market Watch window. I-right click muli ang Market Watch at piliin ang 'Show All'. Kung may mga greyed-out na simbolo, maaari ninyong i-right click at piliin ang 'Hide'. Kung patuloy pa rin ang problema sa inyong trading platform, makipag-ugnayan sa aming Live Agents para sa technical assistance."
qa_485,Can I register from Mauritius,"We offer services in many countries, which you can see by visiting our registration page and clicking 'Register.' If your country of residence is not an option, it means we don't service your region at this time. We are not able to service residents of certain jurisdictions, including the USA, Canada, Sudan, Syria, Iran, and North Korea. You can start registering from our website by clicking 'Register.'"
qa_486,Mauritius registration available,"We offer services in many countries, which you can see by visiting our registration page and clicking 'Register.' If your country of residence is not an option, it means we don't service your region at this time. We are not able to service residents of certain jurisdictions, including the USA, Canada, Sudan, Syria, Iran, and North Korea. You can start registering from our website by clicking 'Register.'"
