id,user,standard_answer
qa_726,Trading history not visible,"To view your trading history, log in to your myHF area and go to My Trading Accounts, select the specific account, and check the History or Reports section. You can also view trading history directly in your MT4/MT5 platform under the Account History tab. If you cannot access your trading history, please contact our Live Agents for assistance with account access."
qa_727,Where is my trading history,"To view your trading history, log in to your myHF area and go to My Trading Accounts, select the specific account, and check the History or Reports section. You can also view trading history directly in your MT4/MT5 platform under the Account History tab. If you cannot access your trading history, please contact our Live Agents for assistance with account access."
qa_728,What are swap charges,"Swap charges are overnight financing costs applied to positions held after market close. These charges depend on the instrument traded, position size, and current interest rates. You can view swap rates for each instrument in your trading platform or on our website under Trading Conditions. Swap charges are automatically calculated and applied to your account. For detailed swap information, please contact our Live Agents."
qa_729,Explain swap fees,"Swap charges are overnight financing costs applied to positions held after market close. These charges depend on the instrument traded, position size, and current interest rates. You can view swap rates for each instrument in your trading platform or on our website under Trading Conditions. Swap charges are automatically calculated and applied to your account. For detailed swap information, please contact our Live Agents."
qa_730,Turn on notifications,"To enable notifications, log in to your myHF area, go to Settings or Preferences, and configure your notification preferences for deposits, withdrawals, trading alerts, and account updates. You can also enable push notifications in the HFM mobile app. For email notifications, ensure your email address is verified in your account settings."
qa_731,Enable account notifications,"To enable notifications, log in to your myHF area, go to Settings or Preferences, and configure your notification preferences for deposits, withdrawals, trading alerts, and account updates. You can also enable push notifications in the HFM mobile app. For email notifications, ensure your email address is verified in your account settings."
qa_732,Account verification delayed,"Account verification typically takes 24-48 hours after submitting all required documents. If your verification is taking longer, please ensure: You submitted clear, colored scanned copies of valid documents, the name on your ID matches your account registration exactly, your address document is not older than 6 months. If you need urgent verification, please contact our Live Agents with your account details."
qa_733,WebTerminal not accessible,"If you cannot access WebTerminal, please try: Using a different web browser, clearing your browser cache and cookies, disabling browser extensions temporarily, checking if JavaScript is enabled, trying an incognito/private browsing window. WebTerminal requires a stable internet connection and updated browser. If issues persist, please contact our Live Agents for technical assistance."
qa_734,Cannot open WebTerminal,"If you cannot access WebTerminal, please try: Using a different web browser, clearing your browser cache and cookies, disabling browser extensions temporarily, checking if JavaScript is enabled, trying an incognito/private browsing window. WebTerminal requires a stable internet connection and updated browser. If issues persist, please contact our Live Agents for technical assistance."
qa_735,What is margin call,"A margin call occurs when your account equity falls below the required margin level for your open positions. This means you need to either deposit more funds or close some positions to maintain adequate margin. You can monitor your margin level in your trading platform. To avoid margin calls, manage your risk carefully and maintain sufficient account balance relative to your position sizes."
qa_736,Calculate pip value,"Pip value calculation depends on the currency pair, lot size, and your account currency. For most major pairs, 1 pip = 0.0001. The pip value formula is: (Pip in decimal places × Trade Size) / Exchange Rate to Account Currency. You can use our pip calculator on the website or view pip values directly in your trading platform. For assistance with calculations, please contact our Live Agents."
qa_737,Pip value calculation,"Pip value calculation depends on the currency pair, lot size, and your account currency. For most major pairs, 1 pip = 0.0001. The pip value formula is: (Pip in decimal places × Trade Size) / Exchange Rate to Account Currency. You can use our pip calculator on the website or view pip values directly in your trading platform. For assistance with calculations, please contact our Live Agents."
qa_738,Compare trading platforms,"HFM offers multiple trading platforms: MT4 (MetaTrader 4) - popular, user-friendly, excellent for forex trading; MT5 (MetaTrader 5) - advanced features, more timeframes, better for stocks and commodities; WebTerminal - browser-based, no download required; HFM App - mobile trading on iOS and Android. Each platform has unique features. You can try all platforms with your account credentials to find your preference."
qa_739,Platform differences,"HFM offers multiple trading platforms: MT4 (MetaTrader 4) - popular, user-friendly, excellent for forex trading; MT5 (MetaTrader 5) - advanced features, more timeframes, better for stocks and commodities; WebTerminal - browser-based, no download required; HFM App - mobile trading on iOS and Android. Each platform has unique features. You can try all platforms with your account credentials to find your preference."
qa_740,Set stop loss order,"To set a stop loss: In MT4/MT5, right-click on your open position, select 'Modify or Delete Order', enter your desired stop loss price in the S/L field, and click 'Modify'. You can also set stop loss when opening a new position by filling the S/L field before placing the order. Stop loss helps limit potential losses by automatically closing positions at predetermined levels."
qa_741,How to add stop loss,"To set a stop loss: In MT4/MT5, right-click on your open position, select 'Modify or Delete Order', enter your desired stop loss price in the S/L field, and click 'Modify'. You can also set stop loss when opening a new position by filling the S/L field before placing the order. Stop loss helps limit potential losses by automatically closing positions at predetermined levels."
qa_742,Bonus terms,"Bonus terms and conditions vary depending on the specific promotion. Generally, bonuses may have trading volume requirements, time limitations, and withdrawal restrictions. You can view detailed terms for each bonus in your myHF area under Promotions or on our website's promotions page. For specific bonus inquiries and terms clarification, please contact our Live Agents."
qa_743,Promotion conditions,"Bonus terms and conditions vary depending on the specific promotion. Generally, bonuses may have trading volume requirements, time limitations, and withdrawal restrictions. You can view detailed terms for each bonus in your myHF area under Promotions or on our website's promotions page. For specific bonus inquiries and terms clarification, please contact our Live Agents."
qa_744,Close all open positions,"To close all positions: In MT4/MT5, you can right-click in the Trade tab and select 'Close All' or close positions individually by right-clicking each position and selecting 'Close Order'. In WebTerminal, use similar right-click options. For mobile apps, tap on each position and select close. Be careful when closing all positions as this action cannot be undone."
qa_745,How to close all trades,"To close all positions: In MT4/MT5, you can right-click in the Trade tab and select 'Close All' or close positions individually by right-clicking each position and selecting 'Close Order'. In WebTerminal, use similar right-click options. For mobile apps, tap on each position and select close. Be careful when closing all positions as this action cannot be undone."
qa_746,Use economic calendar,"The economic calendar shows important economic events that may impact market prices. You can access it on our website or through your trading platform. The calendar displays event time, currency affected, impact level (low/medium/high), and forecasted vs actual values. Use it to plan your trading around major news releases and avoid unexpected market volatility."
qa_747,Economic calendar guide,"The economic calendar shows important economic events that may impact market prices. You can access it on our website or through your trading platform. The calendar displays event time, currency affected, impact level (low/medium/high), and forecasted vs actual values. Use it to plan your trading around major news releases and avoid unexpected market volatility."
qa_748,Change account password,"To change your account password: Log in to your myHF area, go to Settings or Account Settings, select 'Change Password', enter your current password and new password, and confirm the change. For trading platform passwords, you may need to contact our Live Agents. Always use strong passwords with a combination of letters, numbers, and special characters for security."
qa_749,How to update password,"To change your account password: Log in to your myHF area, go to Settings or Account Settings, select 'Change Password', enter your current password and new password, and confirm the change. For trading platform passwords, you may need to contact our Live Agents. Always use strong passwords with a combination of letters, numbers, and special characters for security."
qa_750,Account disabled for trading,"Your account will not be disabled for normal trading activities. However, accounts may be restricted for: Violation of terms and conditions, suspicious or fraudulent activity, incomplete verification, or regulatory compliance issues. If you receive any account restriction notices, please contact our Live Agents immediately for clarification and resolution steps."
qa_751,Will my account get disabled,"Your account will not be disabled for normal trading activities. However, accounts may be restricted for: Violation of terms and conditions, suspicious or fraudulent activity, incomplete verification, or regulatory compliance issues. If you receive any account restriction notices, please contact our Live Agents immediately for clarification and resolution steps."
qa_752,About HFM platform,"HFM is a global forex and CFD broker offering multiple trading platforms (MT4, MT5, WebTerminal, Mobile Apps), competitive spreads, various account types (Cent, Premium, Pro, Zero), and comprehensive educational resources. We provide 24/5 customer support, fast execution, and access to forex, commodities, indices, and stocks. Visit our website at hfm.com for complete platform information and account opening."
qa_753,Demo contest winners,"Demo contest results and winners are announced after each contest period ends. You can check results in your myHF area under Contests section, on our website's promotions page, or through email notifications if you participated. Contest winners are typically notified directly and prizes are credited according to contest terms. For specific contest inquiries, please contact our Live Agents."
qa_754,Check demo contest results,"Demo contest results and winners are announced after each contest period ends. You can check results in your myHF area under Contests section, on our website's promotions page, or through email notifications if you participated. Contest winners are typically notified directly and prizes are credited according to contest terms. For specific contest inquiries, please contact our Live Agents."
qa_755,Recover lost email access,"If you have lost access to your registered email address, you can still request changes or support by following these steps: Send an email from your new email address to the contact email provided on our Contact Us page at https://www.hfm.com/int/en/contact-us. In your email, include: A front and back copy of your registered ID document, a clear photo of yourself holding your registered ID document (ensure both your face and the ID are fully visible), and confirm your old email address. This process helps us verify your identity and update your account details accordingly."
qa_756,Lost email account access,"If you have lost access to your registered email address, you can still request changes or support by following these steps: Send an email from your new email address to the contact email provided on our Contact Us page at https://www.hfm.com/int/en/contact-us. In your email, include: A front and back copy of your registered ID document, a clear photo of yourself holding your registered ID document (ensure both your face and the ID are fully visible), and confirm your old email address. This process helps us verify your identity and update your account details accordingly."
qa_757,NGN deposit to USD account no ID,"Since your HFM account is in USD and you made a deposit in NGN without adding your ID, please send a screenshot or confirmation of your deposit transaction to deposit@hfm.com. Our Deposit Department will assist you in resolving the issue. Also, remember that if your account is already funded, changing the base currency is not possible. For future deposits, ensure the currency matches your account's base currency to avoid complications. If you haven't funded your account yet and want to change the base currency, you need to email from your registered email address with your request and account number before making any deposit."
qa_758,Deposited wrong currency without ID,"Since your HFM account is in USD and you made a deposit in NGN without adding your ID, please send a screenshot or confirmation of your deposit transaction to deposit@hfm.com. Our Deposit Department will assist you in resolving the issue. Also, remember that if your account is already funded, changing the base currency is not possible. For future deposits, ensure the currency matches your account's base currency to avoid complications. If you haven't funded your account yet and want to change the base currency, you need to email from your registered email address with your request and account number before making any deposit."
qa_759,Forgot ID different currency deposit,"If you forgot to add your ID when making a deposit in a currency different from your account's base currency, please send a screenshot or confirmation of your deposit transaction to deposit@hfm.com. Our Deposit Department will help resolve this issue. Note that base currency changes are only possible before the first deposit. For future transactions, ensure the deposit currency matches your account's base currency."
qa_760,No ID added currency mismatch deposit,"If you forgot to add your ID when making a deposit in a currency different from your account's base currency, please send a screenshot or confirmation of your deposit transaction to deposit@hfm.com. Our Deposit Department will help resolve this issue. Note that base currency changes are only possible before the first deposit. For future transactions, ensure the deposit currency matches your account's base currency."
qa_761,Live account disconnected why,"If your live account was disconnected, this could be due to several reasons: Technical issues (network problems, server maintenance, platform updates), account verification issues or incomplete documentation, reaching the maximum limit of 7 live MT4 or 5 live MT5 trading accounts, compliance or regulatory requirements, or account violations. For technical disconnection, try restarting your platform and checking your internet connection. For account-related disconnections, please contact our Live Agents immediately for specific assistance and to understand the exact reason for your account disconnection."
qa_762,Why did my account disconnect,"If your live account was disconnected, this could be due to several reasons: Technical issues (network problems, server maintenance, platform updates), account verification issues or incomplete documentation, reaching the maximum limit of 7 live MT4 or 5 live MT5 trading accounts, compliance or regulatory requirements, or account violations. For technical disconnection, try restarting your platform and checking your internet connection. For account-related disconnections, please contact our Live Agents immediately for specific assistance and to understand the exact reason for your account disconnection."
qa_763,Unarchive account,"Once a trading account is archived, it cannot be reactivated or moved back from archived status. Archiving is a permanent action that cannot be undone. If you need to continue trading, you will need to create a new trading account through your myHF area by going to Trading Accounts > Open Live Account. If you have reached the maximum number of live accounts, you may need to archive an existing account first to create space for a new one."
qa_764,Move from archived status,"Once a trading account is archived, it cannot be reactivated or moved back from archived status. Archiving is a permanent action that cannot be undone. If you need to continue trading, you will need to create a new trading account through your myHF area by going to Trading Accounts > Open Live Account. If you have reached the maximum number of live accounts, you may need to archive an existing account first to create space for a new one."
qa_765,Withdrawal debited not received,"If your withdrawal has been debited from your HFM wallet but not yet received in your bank account, this may be due to processing times by your bank or payment provider. You can check your withdrawal status in myHF area under My Wallet > Wallet Actions > Wallet Finances > Withdrawals tab. If the delay continues, send a screenshot of your withdrawal confirmation to deposit@hfm.com for assistance."
qa_766,Withdrawal taken but not in bank,"If your withdrawal has been debited from your HFM wallet but not yet received in your bank account, this may be due to processing times by your bank or payment provider. You can check your withdrawal status in myHF area under My Wallet > Wallet Actions > Wallet Finances > Withdrawals tab. If the delay continues, send a screenshot of your withdrawal confirmation to deposit@hfm.com for assistance."
qa_767,Take profit hit trade not closed,"If your trade has hit the take profit level but did not close automatically, this could be due to a temporary delay or technical issue. Please try the following steps: Refresh your trading platform or log out and log back in, check your internet connection to ensure it is stable, restart your MT4/MT5 platform. If the issue persists, contact our Live Agents for immediate assistance to investigate the matter further and help close the trade if needed."
qa_768,TP reached but position still open,"If your trade has hit the take profit level but did not close automatically, this could be due to a temporary delay or technical issue. Please try the following steps: Refresh your trading platform or log out and log back in, check your internet connection to ensure it is stable, restart your MT4/MT5 platform. If the issue persists, contact our Live Agents for immediate assistance to investigate the matter further and help close the trade if needed."
qa_769,Trading disabled on server,"Trading for your account may be disabled on the server for several reasons, including: Your account might have reached the maximum limit of live trading accounts allowed. In this case, you would need to archive one or more existing accounts to open or activate another. There could be server-related issues or maintenance affecting your account's trading capabilities. Your account status might require verification or there could be restrictions applied by the platform. To resolve this, please try logging out and back in, check if you have exceeded the account limits, or contact support for specific details related to your account status."
qa_770,Account trading disabled server,"Trading for your account may be disabled on the server for several reasons, including: Your account might have reached the maximum limit of live trading accounts allowed. In this case, you would need to archive one or more existing accounts to open or activate another. There could be server-related issues or maintenance affecting your account's trading capabilities. Your account status might require verification or there could be restrictions applied by the platform. To resolve this, please try logging out and back in, check if you have exceeded the account limits, or contact support for specific details related to your account status."
qa_771,Minimum deposit amount,"The minimum deposit amount varies depending on the account type and deposit method. To get the precise information regarding minimum deposits, please log in to your myHF area and check the Account Types section or the Deposit page for detailed information. You can also visit https://www.hfm.com/int/en/trading-accounts to view all our accounts and their minimum deposit requirements."
qa_772,What is minimum deposit,"The minimum deposit amount varies depending on the account type and deposit method. To get the precise information regarding minimum deposits, please log in to your myHF area and check the Account Types section or the Deposit page for detailed information. You can also visit https://www.hfm.com/int/en/trading-accounts to view all our accounts and their minimum deposit requirements."
qa_773,Wallet not credited yesterday,"If your wallet has not been credited since yesterday, please make sure the deposit transaction was successful. If it was, kindly send a screenshot or any confirmation of the successful transaction to deposit@hfm.com. Our Deposit Department will assist you further to resolve the issue."
qa_774,Wallet credit not showing,"If your wallet has not been credited since yesterday, please make sure the deposit transaction was successful. If it was, kindly send a screenshot or any confirmation of the successful transaction to deposit@hfm.com. Our Deposit Department will assist you further to resolve the issue."
qa_775,Downloaded app don't know how to use,"Thank you for your interest! To get started with our app and make the most of it, please follow these steps: Register an Account: Open the app and create your myHF account by following the registration prompts. This account acts as your wallet and lets you manage deposits, withdrawals, and trading accounts. Create a Trading Account: After logging into your myHF area, you can open a Live or Demo trading account from the menu under Trading Accounts by selecting Open Live Account or Open Demo Account. You will need to set a trading account password. Chat and Support: For chatting or support, you can usually find a help or contact section within the app or on our website where you can reach out to our support team. Benefits: With your trading account, you can trade various assets, practice on demo accounts, and manage your funds easily through the app. If you need help with specific features or have questions, feel free to ask!"
qa_776,New to app need help,"Thank you for your interest! To get started with our app and make the most of it, please follow these steps: Register an Account: Open the app and create your myHF account by following the registration prompts. This account acts as your wallet and lets you manage deposits, withdrawals, and trading accounts. Create a Trading Account: After logging into your myHF area, you can open a Live or Demo trading account from the menu under Trading Accounts by selecting Open Live Account or Open Demo Account. You will need to set a trading account password. Chat and Support: For chatting or support, you can usually find a help or contact section within the app or on our website where you can reach out to our support team. Benefits: With your trading account, you can trade various assets, practice on demo accounts, and manage your funds easily through the app. If you need help with specific features or have questions, feel free to ask!"
qa_777,No bonus after funding,"If you didn't receive a bonus after funding your account, this could be due to several reasons: the deposit may not meet the minimum bonus requirements, your account may not be eligible for the current promotion, or the bonus may have specific terms and conditions. The most common reasons for bonus issues are: Withdrawing deposited funds, as the bonus is also proportionally removed to the amount withdrawn (check promotional terms and conditions for more), Violating bonus terms, which could include specific trading rules or account activity requirements (check promotional terms and conditions for more). For specific details about why your bonus was not received, please check your myHF area or contact our Live Agents directly. They can provide information regarding your specific account and bonus status."
