user,standard_answer,status,most_similar_existing
What is the HFM Partners program?,HFM Partners is the program for individuals and businesses who wish to earn commissions by referring clients to HFM. The main partnership types are Affiliates (for online marketers) and Introducing Brokers (IBs) (for those who may provide more direct support to clients). HFM also offers White Label solutions and Regional Officer partnerships.,,
Tell me about becoming an affiliate or partner.,HFM Partners is the program for individuals and businesses who wish to earn commissions by referring clients to HFM. The main partnership types are Affiliates (for online marketers) and Introducing Brokers (IBs) (for those who may provide more direct support to clients). HFM also offers White Label solutions and Regional Officer partnerships.,,
What partnership types does HFM offer?,HFM Partners is the program for individuals and businesses who wish to earn commissions by referring clients to HFM. The main partnership types are Affiliates (for online marketers) and Introducing Brokers (IBs) (for those who may provide more direct support to clients). HFM also offers White Label solutions and Regional Officer partnerships.,,
ow much do HFM Affiliates earn?,HFM Affiliates can earn up to $30 per lot on the trades of their referred clients. HFM also offers an impressive 60% Revenue Share option and a multi-tier commission structure (up to 5 levels) for sub-affiliates.,,
What is the commission for partners?,HFM Affiliates can earn up to $30 per lot on the trades of their referred clients. HFM also offers an impressive 60% Revenue Share option and a multi-tier commission structure (up to 5 levels) for sub-affiliates.,,
What is the affiliate revenue share?,HFM Affiliates can earn up to $30 per lot on the trades of their referred clients. HFM also offers an impressive 60% Revenue Share option and a multi-tier commission structure (up to 5 levels) for sub-affiliates.,,
Is there a fee to become an HFM Partner?,"No, there are no setup fees to join the HFM Partners program.",,
Does it cost anything to become an affiliate?,"No, there are no setup fees to join the HFM Partners program.",,
Are there setup fees for the partnership program?,"No, there are no setup fees to join the HFM Partners program.",,
"What does the €5,000,000 insurance policy cover?","HFM has a market-leading Civil Liability insurance program with a limit of €5,000,000. This policy is designed to protect HFM's liabilities against clients and covers risks such as fraud, errors, omissions, negligence, and other events that could lead to a client's financial loss.",,
Tell me more about the 5 million euro insurance.,"HFM has a market-leading Civil Liability insurance program with a limit of €5,000,000. This policy is designed to protect HFM's liabilities against clients and covers risks such as fraud, errors, omissions, negligence, and other events that could lead to a client's financial loss.",,
What is the Civil Liability insurance for?,"HFM has a market-leading Civil Liability insurance program with a limit of €5,000,000. This policy is designed to protect HFM's liabilities against clients and covers risks such as fraud, errors, omissions, negligence, and other events that could lead to a client's financial loss.",,
Can I lose more than my deposit?,"HFM offers Negative Balance Protection on all accounts. This is a safety feature that guarantees you can never lose more than the total funds in your account. If a trade results in a negative balance, HFM will automatically reset it to zero, at no cost to you.",,
What happens if my account balance goes negative?,"HFM offers Negative Balance Protection on all accounts. This is a safety feature that guarantees you can never lose more than the total funds in your account. If a trade results in a negative balance, HFM will automatically reset it to zero, at no cost to you.",,
What is a 'Strategy Provider'?,"A Strategy Provider is an experienced trader who showcases their trading skills to the HFM community. Other traders, known as ""Followers,"" can then find their profile and choose to automatically copy their trades.",,
Tell me about Strategy Providers.,"A Strategy Provider is an experienced trader who showcases their trading skills to the HFM community. Other traders, known as ""Followers,"" can then find their profile and choose to automatically copy their trades.",,
Who can I copy in Copy Trading?,"A Strategy Provider is an experienced trader who showcases their trading skills to the HFM community. Other traders, known as ""Followers,"" can then find their profile and choose to automatically copy their trades.",,
What are 'HFM Bars'?,"HFM Bars are the reward points you earn through the HFM Loyalty Program.  You can earn HFM Bars for:  Trading: You earn a set number of HFM Bars for every round-turn standard lot you trade on eligible products (like Forex and Gold).  Account Milestones: You can also earn bars for actions like getting your account approved, funding your account, and successfully referring friends.  You can redeem your HFM Bars for:  Cash (at a rate of 35 Bars = 1 USD, with a 1,000 Bar minimum)  Trading Services (such as a VPS subscription or a private session with an HFM Market Analyst)  Credit Bonuses",,
What can I do with HFM Bars?,"HFM Bars are the reward points you earn through the HFM Loyalty Program.  You can earn HFM Bars for:  Trading: You earn a set number of HFM Bars for every round-turn standard lot you trade on eligible products (like Forex and Gold).  Account Milestones: You can also earn bars for actions like getting your account approved, funding your account, and successfully referring friends.  You can redeem your HFM Bars for:  Cash (at a rate of 35 Bars = 1 USD, with a 1,000 Bar minimum)  Trading Services (such as a VPS subscription or a private session with an HFM Market Analyst)  Credit Bonuses",,
How do I earn HFM Bars?,"HFM Bars are the reward points you earn through the HFM Loyalty Program.  You can earn HFM Bars for:  Trading: You earn a set number of HFM Bars for every round-turn standard lot you trade on eligible products (like Forex and Gold).  Account Milestones: You can also earn bars for actions like getting your account approved, funding your account, and successfully referring friends.  You can redeem your HFM Bars for:  Cash (at a rate of 35 Bars = 1 USD, with a 1,000 Bar minimum)  Trading Services (such as a VPS subscription or a private session with an HFM Market Analyst)  Credit Bonuses",,
What is the 'Return on Free Margin' (ROFM) program?,"The Return on Free Margin (ROFM) program is a promotion that pays you daily earnings on your free margin (the equity in your account not currently used for open positions).  To qualify, you must trade at least 5 lots on Forex or Metals within a month and maintain a cumulative free margin of over $1,000. Your earnings are calculated daily based on your free margin and total monthly trading volume, with rates ranging from 2% to 3%. The total return is paid into your wallet monthly and can be withdrawn or used for trading.",,
Tell me about the ROFM program.,"The Return on Free Margin (ROFM) program is a promotion that pays you daily earnings on your free margin (the equity in your account not currently used for open positions).  To qualify, you must trade at least 5 lots on Forex or Metals within a month and maintain a cumulative free margin of over $1,000. Your earnings are calculated daily based on your free margin and total monthly trading volume, with rates ranging from 2% to 3%. The total return is paid into your wallet monthly and can be withdrawn or used for trading.",,
How does the Return on Free Margin work?,"The Return on Free Margin (ROFM) program is a promotion that pays you daily earnings on your free margin (the equity in your account not currently used for open positions).  To qualify, you must trade at least 5 lots on Forex or Metals within a month and maintain a cumulative free margin of over $1,000. Your earnings are calculated daily based on your free margin and total monthly trading volume, with rates ranging from 2% to 3%. The total return is paid into your wallet monthly and can be withdrawn or used for trading.",,
Do you have a demo trading contest?,"HFM offers a monthly 'Virtual to Real' Demo Contest. It is a risk-free competition where you trade with a $10,000 virtual deposit.  The contest runs from the first to the last day of the month. The top three traders with the highest percentage gain at the end of the month win trading bonuses (e.g., $500, $300, $100) and the 1st place winner also receives the HFM Crystal Obelisk. These prize funds are credited to a live trading account and cannot be withdrawn, but any profits made from trading them can be withdrawn after meeting specific volume requirements.",,
Are there any demo trading competitions?,"HFM offers a monthly 'Virtual to Real' Demo Contest. It is a risk-free competition where you trade with a $10,000 virtual deposit.  The contest runs from the first to the last day of the month. The top three traders with the highest percentage gain at the end of the month win trading bonuses (e.g., $500, $300, $100) and the 1st place winner also receives the HFM Crystal Obelisk. These prize funds are credited to a live trading account and cannot be withdrawn, but any profits made from trading them can be withdrawn after meeting specific volume requirements.",,
How does the demo contest work?,"HFM offers a monthly 'Virtual to Real' Demo Contest. It is a risk-free competition where you trade with a $10,000 virtual deposit.  The contest runs from the first to the last day of the month. The top three traders with the highest percentage gain at the end of the month win trading bonuses (e.g., $500, $300, $100) and the 1st place winner also receives the HFM Crystal Obelisk. These prize funds are credited to a live trading account and cannot be withdrawn, but any profits made from trading them can be withdrawn after meeting specific volume requirements.",,
What is a PAMM Investor?,"A PAMM Investor is a client who allocates their funds to an experienced PAMM Fund Manager. The Fund Manager then trades with this pool of funds on the Investor's behalf. The Investor can search the PAMM rankings to find a Manager that suits their goals, and they will share in the profits and losses of the strategy.",,
How do I invest in a PAMM account?,"A PAMM Investor is a client who allocates their funds to an experienced PAMM Fund Manager. The Fund Manager then trades with this pool of funds on the Investor's behalf. The Investor can search the PAMM rankings to find a Manager that suits their goals, and they will share in the profits and losses of the strategy.",,
What is the role of an Investor in the PAMM program?,"A PAMM Investor is a client who allocates their funds to an experienced PAMM Fund Manager. The Fund Manager then trades with this pool of funds on the Investor's behalf. The Investor can search the PAMM rankings to find a Manager that suits their goals, and they will share in the profits and losses of the strategy.",,
What is a PAMM Fund Manager?,"A PAMM Fund Manager is an HFM client who manages their own funds as well as the funds of other Investors in a single pool. To become a Fund Manager, you must open a PAMM Manager account and deposit your own ""Manager's Capital."" As compensation for successful trading, the Manager receives a pre-agreed ""Success Fee"" from the profits earned by their Investors.",,
How do I become a PAMM Fund Manager?,"A PAMM Fund Manager is an HFM client who manages their own funds as well as the funds of other Investors in a single pool. To become a Fund Manager, you must open a PAMM Manager account and deposit your own ""Manager's Capital."" As compensation for successful trading, the Manager receives a pre-agreed ""Success Fee"" from the profits earned by their Investors.",,
How do PAMM Fund Managers get paid?,"A PAMM Fund Manager is an HFM client who manages their own funds as well as the funds of other Investors in a single pool. To become a Fund Manager, you must open a PAMM Manager account and deposit your own ""Manager's Capital."" As compensation for successful trading, the Manager receives a pre-agreed ""Success Fee"" from the profits earned by their Investors.",,
What is the minimum deposit for a PAMM account?,The PAMM (Premium) account has a minimum deposit of $250. This applies to both the Fund Manager's capital and the minimum amount for an Investor.,,
How much do I need to invest in a PAMM?,The PAMM (Premium) account has a minimum deposit of $250. This applies to both the Fund Manager's capital and the minimum amount for an Investor.,,
What is the PAMM (Premium) account minimum deposit?,The PAMM (Premium) account has a minimum deposit of $250. This applies to both the Fund Manager's capital and the minimum amount for an Investor.,,
What are the features of the HFM App?,"The HFM App is a feature-rich application that allows you to manage your entire trading experience. Its key features include:  Trade On-the-Go: Trade CFDs on Forex, stocks, commodities, and more.  Customize Trading: Place trades flexibly by amount, lots, or units.  Fund Management: Deposit, withdraw, and transfer funds between your accounts easily.  Monitor Your Account: Access your trade history, analyze performance, and monitor your positions.  Tools & Analysis: Access live rates, market analysis, trading calculators, and advanced charting.  myHF Access: The app gives you direct access to your myHF client area.",,
What can I do with the HFM App?,"The HFM App is a feature-rich application that allows you to manage your entire trading experience. Its key features include:  Trade On-the-Go: Trade CFDs on Forex, stocks, commodities, and more.  Customize Trading: Place trades flexibly by amount, lots, or units.  Fund Management: Deposit, withdraw, and transfer funds between your accounts easily.  Monitor Your Account: Access your trade history, analyze performance, and monitor your positions.  Tools & Analysis: Access live rates, market analysis, trading calculators, and advanced charting.  myHF Access: The app gives you direct access to your myHF client area.",,
Is the HFM App just for trading?,"The HFM App is a feature-rich application that allows you to manage your entire trading experience. Its key features include:  Trade On-the-Go: Trade CFDs on Forex, stocks, commodities, and more.  Customize Trading: Place trades flexibly by amount, lots, or units.  Fund Management: Deposit, withdraw, and transfer funds between your accounts easily.  Monitor Your Account: Access your trade history, analyze performance, and monitor your positions.  Tools & Analysis: Access live rates, market analysis, trading calculators, and advanced charting.  myHF Access: The app gives you direct access to your myHF client area.",,
How do I open a live account?,"To open a live account, you just need to:  Complete the simple online registration form.  Submit your documents to verify your account (this is known as the KYC process).  Once verified, you can fund your account and start trading.",,
What is the process to open a trading account?,"To open a live account, you just need to:  Complete the simple online registration form.  Submit your documents to verify your account (this is known as the KYC process).  Once verified, you can fund your account and start trading.",,
What are the steps to register with HFM?,"To open a live account, you just need to:  Complete the simple online registration form.  Submit your documents to verify your account (this is known as the KYC process).  Once verified, you can fund your account and start trading.",,
What documents do I need to verify my HFM account?,"For a live account, you need to provide at least two documents:  Proof of Identification: A current (not expired) color copy of your Passport. If a passport is not available, a National ID card or Driver's License is accepted.  Proof of Address: A bank statement or utility bill (e.g., electricity, water, or phone bill) that is not older than 6 months.  The name on both documents must match. You can upload these documents directly through your myHF area.",,
What is KYC documentation?,"For a live account, you need to provide at least two documents:  Proof of Identification: A current (not expired) color copy of your Passport. If a passport is not available, a National ID card or Driver's License is accepted.  Proof of Address: A bank statement or utility bill (e.g., electricity, water, or phone bill) that is not older than 6 months.  The name on both documents must match. You can upload these documents directly through your myHF area.",,
How do I provide Proof of Identification and Proof of Address?,"For a live account, you need to provide at least two documents:  Proof of Identification: A current (not expired) color copy of your Passport. If a passport is not available, a National ID card or Driver's License is accepted.  Proof of Address: A bank statement or utility bill (e.g., electricity, water, or phone bill) that is not older than 6 months.  The name on both documents must match. You can upload these documents directly through your myHF area.",,
Does HFM have job openings?,"Yes, HFM is regularly recruiting for various roles in the fintech field. You can find all open positions on the ""Careers"" page, which is located under the ""About"" section of the website. Job openings are listed for global offices, including Cyprus, South Africa, UAE, Kenya, and more.",,
Where can I find careers at HFM?,"Yes, HFM is regularly recruiting for various roles in the fintech field. You can find all open positions on the ""Careers"" page, which is located under the ""About"" section of the website. Job openings are listed for global offices, including Cyprus, South Africa, UAE, Kenya, and more.",,
Are you hiring?,"Yes, HFM is regularly recruiting for various roles in the fintech field. You can find all open positions on the ""Careers"" page, which is located under the ""About"" section of the website. Job openings are listed for global offices, including Cyprus, South Africa, UAE, Kenya, and more.",,
What is the 'myHF Client Area'?,"The myHF area is your all-in-one account management portal. It is the secure area where you manage all your trading and financial operations with a single login. From the myHF area, you can:  Open new live or demo trading accounts.  Deposit and withdraw funds.  Make internal transfers between your accounts.  Upload your verification documents (KYC).  Access trading tools like Autochartist and Premium Trader Tools.  Monitor your financial transaction history.",,
Tell me about the myHF area.,"The myHF area is your all-in-one account management portal. It is the secure area where you manage all your trading and financial operations with a single login. From the myHF area, you can:  Open new live or demo trading accounts.  Deposit and withdraw funds.  Make internal transfers between your accounts.  Upload your verification documents (KYC).  Access trading tools like Autochartist and Premium Trader Tools.  Monitor your financial transaction history.",,
What's the myHF portal used for?,"The myHF area is your all-in-one account management portal. It is the secure area where you manage all your trading and financial operations with a single login. From the myHF area, you can:  Open new live or demo trading accounts.  Deposit and withdraw funds.  Make internal transfers between your accounts.  Upload your verification documents (KYC).  Access trading tools like Autochartist and Premium Trader Tools.  Monitor your financial transaction history.",,
What are the features of an HFM Demo Account?,"The HFM Demo Account is designed to simulate a real trading environment using actual market conditions. It allows you to practice your trading strategies risk-free. Key features include:  Virtual Balance: You can get up to $100,000 in virtual funds.  Real Conditions: It uses real market data.  Platform Access: You can trade on the MT4 and MT5 platforms.  Unlimited Use: The demo account has unlimited usage, allowing you to practice as long as you need.",,
How does the demo account work?,"The HFM Demo Account is designed to simulate a real trading environment using actual market conditions. It allows you to practice your trading strategies risk-free. Key features include:  Virtual Balance: You can get up to $100,000 in virtual funds.  Real Conditions: It uses real market data.  Platform Access: You can trade on the MT4 and MT5 platforms.  Unlimited Use: The demo account has unlimited usage, allowing you to practice as long as you need.",,
How much virtual money do I get in a demo account?,"The HFM Demo Account is designed to simulate a real trading environment using actual market conditions. It allows you to practice your trading strategies risk-free. Key features include:  Virtual Balance: You can get up to $100,000 in virtual funds.  Real Conditions: It uses real market data.  Platform Access: You can trade on the MT4 and MT5 platforms.  Unlimited Use: The demo account has unlimited usage, allowing you to practice as long as you need.",,
"Are Forex, Indices, and Commodities commission-free?","This depends on your account type.  On Premium, Pro, Pro Plus, and Cent accounts, trading on Forex, Indices, and Commodities is commission-free. Your cost is included in the spread.  On the Zero account, you get raw, super-tight spreads (from 0 pips on Forex) but pay a commission, which starts from as low as $3 per lot.",,
Do I pay commissions on Forex?,"This depends on your account type.  On Premium, Pro, Pro Plus, and Cent accounts, trading on Forex, Indices, and Commodities is commission-free. Your cost is included in the spread.  On the Zero account, you get raw, super-tight spreads (from 0 pips on Forex) but pay a commission, which starts from as low as $3 per lot.",,
Are there commissions on Indices or Commodities?,"This depends on your account type.  On Premium, Pro, Pro Plus, and Cent accounts, trading on Forex, Indices, and Commodities is commission-free. Your cost is included in the spread.  On the Zero account, you get raw, super-tight spreads (from 0 pips on Forex) but pay a commission, which starts from as low as $3 per lot.",,
"Are there swap fees on Forex, Gold, and Indices?","HFM offers swap-free trading on a wide selection of popular instruments for all clients (not just those observing Sharia law). This includes major Forex pairs (like EURUSD, USDJPY), Gold (XAUUSD, XAUEUR), and major Indices (like USA100, USA500, GER40).  For other instruments (like some commodities, exotic pairs, and shares), a daily rollover fee (swap) is applied for positions held open overnight. Triple swaps are typically applied on Wednesdays (or Fridays for Indices) to account for the weekend.",,
Are all instruments swap-free?,"HFM offers swap-free trading on a wide selection of popular instruments for all clients (not just those observing Sharia law). This includes major Forex pairs (like EURUSD, USDJPY), Gold (XAUUSD, XAUEUR), and major Indices (like USA100, USA500, GER40).  For other instruments (like some commodities, exotic pairs, and shares), a daily rollover fee (swap) is applied for positions held open overnight. Triple swaps are typically applied on Wednesdays (or Fridays for Indices) to account for the weekend.",,
What is the Rollover Policy?,"HFM offers swap-free trading on a wide selection of popular instruments for all clients (not just those observing Sharia law). This includes major Forex pairs (like EURUSD, USDJPY), Gold (XAUUSD, XAUEUR), and major Indices (like USA100, USA500, GER40).  For other instruments (like some commodities, exotic pairs, and shares), a daily rollover fee (swap) is applied for positions held open overnight. Triple swaps are typically applied on Wednesdays (or Fridays for Indices) to account for the weekend.",,
What is the maximum leverage for Gold?,"HFM offers leverage up to 1:2000 on Gold (XAUUSD and XAUEUR), depending on your account type.",,
How much leverage can I use for Gold trading?,"HFM offers leverage up to 1:2000 on Gold (XAUUSD and XAUEUR), depending on your account type.",,
What's the leverage for XAUUSD?,"HFM offers leverage up to 1:2000 on Gold (XAUUSD and XAUEUR), depending on your account type.",,
What is the leverage for Indices?,"The leverage for Indices varies by the specific index. HFM offers:  Up to 1:1000 on the USA100  Up to 1:500 on the USA30, USA500, GER40, and JPN225  Up to 1:200 on most other indices like the UK100 and FRA40",,
How much leverage can I use on Indices?,"The leverage for Indices varies by the specific index. HFM offers:  Up to 1:1000 on the USA100  Up to 1:500 on the USA30, USA500, GER40, and JPN225  Up to 1:200 on most other indices like the UK100 and FRA40",,
What's the leverage for the USA100 or USA500?,"The leverage for Indices varies by the specific index. HFM offers:  Up to 1:1000 on the USA100  Up to 1:500 on the USA30, USA500, GER40, and JPN225  Up to 1:200 on most other indices like the UK100 and FRA40",,
What is the leverage for Energies (Oil)?,"HFM offers leverage up to 1:200 on energy CFDs, including UK Brent Oil (UKOIL) and US Crude Oil (USOIL).",,
How much leverage can I use for Oil?,"HFM offers leverage up to 1:200 on energy CFDs, including UK Brent Oil (UKOIL) and US Crude Oil (USOIL).",,
What's the leverage for UKOIL or USOIL?,"HFM offers leverage up to 1:200 on energy CFDs, including UK Brent Oil (UKOIL) and US Crude Oil (USOIL).",,
What is the commission for trading Cryptocurrencies?,Trading Cryptocurrency CFDs is commission-free on HFM's main account types (like Premium and Pro). The cost is built into the spread.,,
Are Crypto CFDs commission-free?,Trading Cryptocurrency CFDs is commission-free on HFM's main account types (like Premium and Pro). The cost is built into the spread.,,
