user,standard_answer,status,most_similar_existing
Why did HotForex change its name to HFM?,"The name was changed to HFM because the new name better reflects the wide variety of products and services the company offers, which go beyond just Foreign Exchange (Forex) to include stocks, indices, cryptocurrencies, and more.",,
What was the reason for HotForex rebranding to HFM?,"The name was changed to HFM because the new name better reflects the wide variety of products and services the company offers, which go beyond just Foreign Exchange (Forex) to include stocks, indices, cryptocurrencies, and more.",,
Why was HotForex renamed to HFM?,"The name was changed to HFM because the new name better reflects the wide variety of products and services the company offers, which go beyond just Foreign Exchange (Forex) to include stocks, indices, cryptocurrencies, and more.",,
How long has HFM been in business?,"The HF Markets Group, of which HFM is a brand, was founded in 2010.",,
When was HFM established?,"The HF Markets Group, of which HFM is a brand, was founded in 2010.",,
What year did HFM start operating?,"The HF Markets Group, of which HFM is a brand, was founded in 2010.",,
How many clients does HFM have?,"As of 2024, the HF Markets Group has over 4 million client accounts.",,
What is HFM's client base size?,"As of 2024, the HF Markets Group has over 4 million client accounts.",,
How many accounts does HFM manage?,"As of 2024, the HF Markets Group has over 4 million client accounts.",,
What account types does HFM offer?,"HFM offers several trading accounts: Premium, Cent, Zero, Pro, and Pro Plus. HFM also provides Swap-Free accounts (often referred to as Islamic accounts) for clients who observe Sharia law.",,
Which accounts are available at HFM?,"HFM offers several trading accounts: Premium, Cent, Zero, Pro, and Pro Plus. HFM also provides Swap-Free accounts (often referred to as Islamic accounts) for clients who observe Sharia law.",,
What kinds of trading accounts does HFM provide?,"HFM offers several trading accounts: Premium, Cent, Zero, Pro, and Pro Plus. HFM also provides Swap-Free accounts (often referred to as Islamic accounts) for clients who observe Sharia law.",,
What are the features of the Zero account?,"The Zero account offers raw, super-tight spreads from 0 pips on Forex and Gold with no hidden markups. It has a $0 minimum deposit and leverage up to 1:2000. It is also swap-free, subject to terms and conditions.",,
Tell me about the Zero account features,"The Zero account offers raw, super-tight spreads from 0 pips on Forex and Gold with no hidden markups. It has a $0 minimum deposit and leverage up to 1:2000. It is also swap-free, subject to terms and conditions.",,
What does the Zero account include?,"The Zero account offers raw, super-tight spreads from 0 pips on Forex and Gold with no hidden markups. It has a $0 minimum deposit and leverage up to 1:2000. It is also swap-free, subject to terms and conditions.",,
Is there a commission on the Zero account?,"Yes, the Zero account has commissions. Commissions start from a low $3 per 1 lot. For all currency pairs, the round turn commission is $6 per 100,000 units (1 standard lot). For Gold, the round turn commission is $10 per 100 ounces. Note that HFM has announced updates reducing commissions from previous levels.",,
Does the Zero account charge commission?,"Yes, the Zero account has commissions. Commissions start from a low $3 per 1 lot. For all currency pairs, the round turn commission is $6 per 100,000 units (1 standard lot). For Gold, the round turn commission is $10 per 100 ounces. Note that HFM has announced updates reducing commissions from previous levels.",,
Are there commission fees on Zero accounts?,"Yes, the Zero account has commissions. Commissions start from a low $3 per 1 lot. For all currency pairs, the round turn commission is $6 per 100,000 units (1 standard lot). For Gold, the round turn commission is $10 per 100 ounces. Note that HFM has announced updates reducing commissions from previous levels.",,
Is there a commission-free account?,"Yes, the Cent, Pro, and Premium accounts are commission-free. Note that for the Pro account, this excludes certain products.",,
Which accounts don't charge commission?,"Yes, the Cent, Pro, and Premium accounts are commission-free. Note that for the Pro account, this excludes certain products.",,
Do you have accounts without commission?,"Yes, the Cent, Pro, and Premium accounts are commission-free. Note that for the Pro account, this excludes certain products.",,
What are the withdrawal fees?,"HFM does not charge withdrawal fees on most transactions, including bank transfers and credit/debit cards. However, for bank wire transfers, HFM notes that the sending, correspondent, and receiving banks may charge their own fees according to their fee structure.",,
Are there any fees for withdrawing money?,"HFM does not charge withdrawal fees on most transactions, including bank transfers and credit/debit cards. However, for bank wire transfers, HFM notes that the sending, correspondent, and receiving banks may charge their own fees according to their fee structure.",,
Why can't I withdraw my profits to my credit card?,"For security and anti-money laundering purposes, HFM can only process withdrawals to credit/debit cards up to the amount that was initially deposited from that card. Any profits or amounts exceeding your total deposits must be withdrawn by another method, such as a bank wire transfer.",,
Why won't my card accept profit withdrawals?,"For security and anti-money laundering purposes, HFM can only process withdrawals to credit/debit cards up to the amount that was initially deposited from that card. Any profits or amounts exceeding your total deposits must be withdrawn by another method, such as a bank wire transfer.",,
Can I withdraw earnings to my credit card?,"For security and anti-money laundering purposes, HFM can only process withdrawals to credit/debit cards up to the amount that was initially deposited from that card. Any profits or amounts exceeding your total deposits must be withdrawn by another method, such as a bank wire transfer.",,
What trading platforms can I use?,"HFM offers the popular MetaTrader 4 (MT4) and MetaTrader 5 (MT5) platforms, as well as the HFM Platform, which is available on the HFM App for iOS and Android.",,
Which platforms does HFM support?,"HFM offers the popular MetaTrader 4 (MT4) and MetaTrader 5 (MT5) platforms, as well as the HFM Platform, which is available on the HFM App for iOS and Android.",,
What platforms are available for trading?,"HFM offers the popular MetaTrader 4 (MT4) and MetaTrader 5 (MT5) platforms, as well as the HFM Platform, which is available on the HFM App for iOS and Android.",,
Why can't I find Crypto or Stocks on my platform?,"CFDs on Cryptocurrencies, ETFs, and DMA (Direct Market Access) stocks are exclusively available on the MT5 and HFM platforms. They are not available on the MT4 platform.",,
Where are Crypto and Stocks on my platform?,"CFDs on Cryptocurrencies, ETFs, and DMA (Direct Market Access) stocks are exclusively available on the MT5 and HFM platforms. They are not available on the MT4 platform.",,
Why don't I see Cryptocurrencies or Stocks?,"CFDs on Cryptocurrencies, ETFs, and DMA (Direct Market Access) stocks are exclusively available on the MT5 and HFM platforms. They are not available on the MT4 platform.",,
What trading tools does HFM provide?,"HFM provides a suite of advanced tools, including Autochartist, Advanced Insights, VPS Hosting, and Premium Trader tools.",,
Which trading tools are available?,"HFM provides a suite of advanced tools, including Autochartist, Advanced Insights, VPS Hosting, and Premium Trader tools.",,
What tools does HFM offer for trading?,"HFM provides a suite of advanced tools, including Autochartist, Advanced Insights, VPS Hosting, and Premium Trader tools.",,
What trading calculators are available?,"HFM offers several free trading calculators: Risk Percentage Calculator, Multitarget Calculator, Pivot Points Calculator, Pip Value Calculator, Position Size Calculator, Swaps Calculator, Risk and Reward Calculator, and Fibonacci Calculator.",,
Which calculators does HFM offer?,"HFM offers several free trading calculators: Risk Percentage Calculator, Multitarget Calculator, Pivot Points Calculator, Pip Value Calculator, Position Size Calculator, Swaps Calculator, Risk and Reward Calculator, and Fibonacci Calculator.",,
Do you have trading calculators?,"HFM offers several free trading calculators: Risk Percentage Calculator, Multitarget Calculator, Pivot Points Calculator, Pip Value Calculator, Position Size Calculator, Swaps Calculator, Risk and Reward Calculator, and Fibonacci Calculator.",,
What does the Swaps Calculator do?,The Swap Calculator is used to determine the interest (swap fee) you will either pay or earn for any CFD position that is held open overnight. This amount is then credited or debited directly to your trades and reflected in your account balance.,,
How does the Swaps Calculator work?,The Swap Calculator is used to determine the interest (swap fee) you will either pay or earn for any CFD position that is held open overnight. This amount is then credited or debited directly to your trades and reflected in your account balance.,,
What is the purpose of the Swaps Calculator?,The Swap Calculator is used to determine the interest (swap fee) you will either pay or earn for any CFD position that is held open overnight. This amount is then credited or debited directly to your trades and reflected in your account balance.,,
What can I trade with HFM?,"HFM offers CFDs on over 500 markets. The categories include Forex, Metals (like Gold), Energies (like Crude Oil), Indices, Stocks (like Amazon and Meta), Commodities, Bonds (issued by economies like the UK and US), ETFs, and Cryptocurrencies (like Bitcoin, Ethereum, Ripple, and Litecoin).",,
What markets does HFM offer?,"HFM offers CFDs on over 500 markets. The categories include Forex, Metals (like Gold), Energies (like Crude Oil), Indices, Stocks (like Amazon and Meta), Commodities, Bonds (issued by economies like the UK and US), ETFs, and Cryptocurrencies (like Bitcoin, Ethereum, Ripple, and Litecoin).",,
What regulatory bodies license HFM?,"HFM's group entities are licensed by: the Cyprus Securities and Exchange Commission (CySEC, No. 183/12), the Financial Conduct Authority (FCA) in the UK (No. 801701), the Financial Sector Conduct Authority (FSCA) in South Africa (No. 46632), the Financial Services Authority (FSA) in Seychelles (No. SD015), and the Capital Markets Authority (CMA) in Kenya (No. 155). Some entities are also regulated by the Dubai Financial Services Authority (DFSA).",,
Which regulators oversee HFM?,"HFM's group entities are licensed by: the Cyprus Securities and Exchange Commission (CySEC, No. 183/12), the Financial Conduct Authority (FCA) in the UK (No. 801701), the Financial Sector Conduct Authority (FSCA) in South Africa (No. 46632), the Financial Services Authority (FSA) in Seychelles (No. SD015), and the Capital Markets Authority (CMA) in Kenya (No. 155). Some entities are also regulated by the Dubai Financial Services Authority (DFSA).",,
What is Negative Balance Protection?,"Negative Balance Protection is a safety measure ensuring that you can never lose more money than your account balance. In the unlikely event your balance goes negative due to market volatility, HFM will automatically reset it to zero.",,
How does Negative Balance Protection work?,"Negative Balance Protection is a safety measure ensuring that you can never lose more money than your account balance. In the unlikely event your balance goes negative due to market volatility, HFM will automatically reset it to zero.",,
Explain Negative Balance Protection,"Negative Balance Protection is a safety measure ensuring that you can never lose more money than your account balance. In the unlikely event your balance goes negative due to market volatility, HFM will automatically reset it to zero.",,
Are client funds kept in segregated accounts?,"Yes, all client funds are kept in accounts that are separate from HFM's own company funds. This ensures your funds are protected and cannot be used by the company for operational purposes or to pay creditors in the unlikely event of company default.",,
Does HFM segregate client funds?,"Yes, all client funds are kept in accounts that are separate from HFM's own company funds. This ensures your funds are protected and cannot be used by the company for operational purposes or to pay creditors in the unlikely event of company default.",,
Are my funds kept separately?,"Yes, all client funds are kept in accounts that are separate from HFM's own company funds. This ensures your funds are protected and cannot be used by the company for operational purposes or to pay creditors in the unlikely event of company default.",,
Does HFM offer any bonuses?,"Yes, HFM offers various promotions, including a 100% Deposit Bonus. All promotions are subject to terms and conditions.",,
Are there any bonuses available?,"Yes, HFM offers various promotions, including a 100% Deposit Bonus. All promotions are subject to terms and conditions.",,
What bonuses does HFM provide?,"Yes, HFM offers various promotions, including a 100% Deposit Bonus. All promotions are subject to terms and conditions.",,
Do you have a loyalty program?,"Yes, HFM offers a Loyalty Program where you can collect HFM Bars for trading. These bars can then be exchanged for cash or premium trading services.",,
Is there a loyalty program?,"Yes, HFM offers a Loyalty Program where you can collect HFM Bars for trading. These bars can then be exchanged for cash or premium trading services.",,
Does HFM have a rewards program?,"Yes, HFM offers a Loyalty Program where you can collect HFM Bars for trading. These bars can then be exchanged for cash or premium trading services.",,
What is the 'Return on Free Margin' (ROFM) program?,"The ROFM program allows traders to receive daily earnings from a $1,000,000 prize pool. It offers up to 3% of your daily free margin, which is funded directly into your account.",,
Tell me about the ROFM program,"The ROFM program allows traders to receive daily earnings from a $1,000,000 prize pool. It offers up to 3% of your daily free margin, which is funded directly into your account.",,
How does the Return on Free Margin work?,"The ROFM program allows traders to receive daily earnings from a $1,000,000 prize pool. It offers up to 3% of your daily free margin, which is funded directly into your account.",,
Do you have a demo trading contest?,"Yes, HFM runs a 'Virtual to Real' demo contest, which allows you to trade risk-free on a demo account for a chance to win real trading rewards monthly.",,
Are there any demo trading competitions?,"Yes, HFM runs a 'Virtual to Real' demo contest, which allows you to trade risk-free on a demo account for a chance to win real trading rewards monthly.",,
I'm a beginner. What educational resources do you have?,"HFM offers a complete HFM E-Course in Forex, a step-by-step guide on trading basics, financial chart reading, trading strategies, and trading psychology. HFM also provides a series of educational videos on the basics of CFD trading, fundamental/technical analysis, and how psychology impacts trading.",,
What learning materials are available for beginners?,"HFM offers a complete HFM E-Course in Forex, a step-by-step guide on trading basics, financial chart reading, trading strategies, and trading psychology. HFM also provides a series of educational videos on the basics of CFD trading, fundamental/technical analysis, and how psychology impacts trading.",,
Do you have educational content for new traders?,"HFM offers a complete HFM E-Course in Forex, a step-by-step guide on trading basics, financial chart reading, trading strategies, and trading psychology. HFM also provides a series of educational videos on the basics of CFD trading, fundamental/technical analysis, and how psychology impacts trading.",,
Do you offer market analysis?,"Yes, the HFM Market Analysis Team provides HFM Daily Market Analysis, which includes the latest financial news from around the world and market forecasts. Exclusive Analysis, an Economic Calendar, and an Earnings Calendar are also available.",,
Is market analysis available?,"Yes, the HFM Market Analysis Team provides HFM Daily Market Analysis, which includes the latest financial news from around the world and market forecasts. Exclusive Analysis, an Economic Calendar, and an Earnings Calendar are also available.",,
Does HFM provide market analysis?,"Yes, the HFM Market Analysis Team provides HFM Daily Market Analysis, which includes the latest financial news from around the world and market forecasts. Exclusive Analysis, an Economic Calendar, and an Earnings Calendar are also available.",,
Does HFM have trading webinars?,"Yes, HFM offers a range of free, live trading webinars hosted by experts. Topics cover Live Analysis, Scalping Strategies, and Emotion Control in CFD trading.",,
Are there trading webinars available?,"Yes, HFM offers a range of free, live trading webinars hosted by experts. Topics cover Live Analysis, Scalping Strategies, and Emotion Control in CFD trading.",,
Do you offer webinars for traders?,"Yes, HFM offers a range of free, live trading webinars hosted by experts. Topics cover Live Analysis, Scalping Strategies, and Emotion Control in CFD trading.",,
I have a problem with my deposit or verification. Who do I contact?,"For any questions about funding, withdrawals, or document verification, you can contact the back office team. The email backoffice@hfm.com is provided for document submission and withdrawal-related questions.",,
Who should I contact about deposit issues?,"For any questions about funding, withdrawals, or document verification, you can contact the back office team. The email backoffice@hfm.com is provided for document submission and withdrawal-related questions.",,
How do I contact support for verification problems?,"For any questions about funding, withdrawals, or document verification, you can contact the back office team. The email backoffice@hfm.com is provided for document submission and withdrawal-related questions.",,
I have a question about one of my trades. Who should I email?,"For any queries related to trade execution, you can contact the dedicated Trading Desk at tradingdesk@hfm.com or call +44-203 097 85 75.",,
Who do I contact about trade execution?,"For any queries related to trade execution, you can contact the dedicated Trading Desk at tradingdesk@hfm.com or call +44-203 097 85 75.",,
How can I reach the trading desk?,"For any queries related to trade execution, you can contact the dedicated Trading Desk at tradingdesk@hfm.com or call +44-203 097 85 75.",,
What is HFM's server time?,HFM's server time is subject to Daylight Savings Time (DST). It is GMT+2 during Winter and GMT+3 during Summer. DST begins on the last Sunday of March and ends on the last Sunday of October.,,
What timezone does HFM use?,HFM's server time is subject to Daylight Savings Time (DST). It is GMT+2 during Winter and GMT+3 during Summer. DST begins on the last Sunday of March and ends on the last Sunday of October.,,
Tell me about HFM's server timezone,HFM's server time is subject to Daylight Savings Time (DST). It is GMT+2 during Winter and GMT+3 during Summer. DST begins on the last Sunday of March and ends on the last Sunday of October.,,
Where can I find HFM's legal documents?,"You can find all legal documentation on the HFM website; links are available in the site's footer. The documents available for review include the Account Opening Agreement, Terms of Business, Privacy Policy, Anti Money Laundering Statement, Order Execution Policy, and others.",,
How do I access HFM's legal documentation?,"You can find all legal documentation on the HFM website; links are available in the site's footer. The documents available for review include the Account Opening Agreement, Terms of Business, Privacy Policy, Anti Money Laundering Statement, Order Execution Policy, and others.",,
Where are the legal documents located?,"You can find all legal documentation on the HFM website; links are available in the site's footer. The documents available for review include the Account Opening Agreement, Terms of Business, Privacy Policy, Anti Money Laundering Statement, Order Execution Policy, and others.",,
Where can I read the Client Agreement or Terms of Business?,"The Account Opening Agreement and Terms of Business are available on our Legal Documentation page, accessible from our website.",,
How do I access the Terms of Business?,"The Account Opening Agreement and Terms of Business are available on our Legal Documentation page, accessible from our website.",,
Where is the Client Agreement?,"The Account Opening Agreement and Terms of Business are available on our Legal Documentation page, accessible from our website.",,
What is the maximum leverage on the Cent account?,The maximum leverage for the Cent account is up to 1:2000.,,
Cent account maximum leverage?,The maximum leverage for the Cent account is up to 1:2000.,,
How much leverage can I get on Cent account?,The maximum leverage for the Cent account is up to 1:2000.,,
What is the maximum leverage on the Zero account?,The maximum leverage for the Zero account is up to 1:2000.,,
Zero account maximum leverage?,The maximum leverage for the Zero account is up to 1:2000.,,
How much leverage for Zero account?,The maximum leverage for the Zero account is up to 1:2000.,,
What is the maximum leverage on the Pro account?,The maximum leverage for the Pro account is up to 1:2000.,,
Pro account leverage limit?,The maximum leverage for the Pro account is up to 1:2000.,,
How much leverage on Pro account?,The maximum leverage for the Pro account is up to 1:2000.,,
What is the maximum leverage on the Pro Plus account?,The maximum leverage for the Pro Plus account is up to 1:2000.,,
Pro Plus account leverage?,The maximum leverage for the Pro Plus account is up to 1:2000.,,
What's the leverage for Pro Plus?,The maximum leverage for the Pro Plus account is up to 1:2000.,,
What is the contract size for a Cent account?,"1 lot = 1,000 units (or 0.01 of a Standard lot)",,
How big is one lot on Cent account?,"On a Cent account, 1 lot = 1,000 units (or 0.01 of a Standard lot)",,
Cent account lot size?,"On a Cent account, 1 lot = 1,000 units (or 0.01 of a Standard lot)",,
What is the contract size for a Zero account?,"On a Zero account, 1 lot = 100,000 units (a Standard lot)",,
Zero account lot size?,"On a Zero account, 1 lot = 100,000 units (a Standard lot)",,
How many units in one lot on Zero account?,"On a Zero account, 1 lot = 100,000 units (a Standard lot)",,
What are the spreads on a Cent account?,The Cent account has variable spreads starting from 1.4 pips.,,
Cent account spread size?,The Cent account has variable spreads starting from 1.4 pips.,,
How tight are spreads on Cent account?,The Cent account has variable spreads starting from 1.4 pips.,,
What are the spreads on a Pro account?,The Pro account offers ultra-low spreads starting from 0.5 pips.,,
Pro account spread information?,The Pro account offers ultra-low spreads starting from 0.5 pips.,,
How low are Pro account spreads?,The Pro account offers ultra-low spreads starting from 0.5 pips.,,
Is the Premium account commission-free?,"Yes, the Premium account is commission-free.",,
Does Premium account charge commission?,"Yes, the Premium account is commission-free.",,
Are there commissions on Premium account?,"Yes, the Premium account is commission-free.",,
What is the maximum number of open orders I can have on a Cent account?,The maximum number of simultaneous open orders on a Cent account is 150.,,
How many orders can I open on Cent account?,The maximum number of simultaneous open orders on a Cent account is 150.,,
Cent account order limit?,The maximum number of simultaneous open orders on a Cent account is 150.,,
What is the maximum number of open orders I can have on a Zero account?,The maximum number of simultaneous open orders on a Zero account is 500.,,
Zero account order limit?,The maximum number of simultaneous open orders on a Zero account is 500.,,
How many orders can I have on Zero account?,The maximum number of simultaneous open orders on a Zero account is 500.,,
What is the margin call level for the Cent and Zero accounts?,The margin call level for both the Cent and Zero accounts is 50%.,,
Margin call level for Cent and Zero?,The margin call level for both the Cent and Zero accounts is 50%.,,
At what level is margin call triggered?,The margin call level for both the Cent and Zero accounts is 50%.,,
What is the stop out level for the Cent and Zero accounts?,The stop out level for both the Cent and Zero accounts is 20%.,,
Stop out level for Cent and Zero accounts?,The stop out level for both the Cent and Zero accounts is 20%.,,
At what percentage is stop out?,The stop out level for both the Cent and Zero accounts is 20%.,,
What is the maximum total trade size on a Cent account?,"The maximum total trade size is 200 Cent Lots per position, with a total of 1000 Cent Lots for the account.",,
Cent account maximum trade size?,"The maximum total trade size is 200 Cent Lots per position, with a total of 1000 Cent Lots for the account.",,
How many lots can I trade on Cent account?,"The maximum total trade size is 200 Cent Lots per position, with a total of 1000 Cent Lots for the account.",,
What is the maximum total trade size on a Zero account?,The maximum total trade size is 60 Standard lots per position.,,
Zero account maximum trade size?,The maximum total trade size is 60 Standard lots per position.,,
How many lots can I trade on Zero account?,The maximum total trade size is 60 Standard lots per position.,,
