user,standard_answer,status,most_similar_existing
Does HFM offer support in multiple languages?,"Yes, HFM’s customer support is multilingual, providing assistance in over 27 different languages. The company has a global client base and ensures traders can receive help in their preferred language via email, phone, or live chat. This 24/5 dedicated support in dozens of languages makes it convenient for clients from various regions to communicate with HFM’s support team and get the guidance they need.",,
Is HFM’s customer service multilingual?,"Yes, HFM’s customer support is multilingual, providing assistance in over 27 different languages. The company has a global client base and ensures traders can receive help in their preferred language via email, phone, or live chat. This 24/5 dedicated support in dozens of languages makes it convenient for clients from various regions to communicate with HFM’s support team and get the guidance they need.",,
Can I get help from HFM in my own language?,"Yes, HFM’s customer support is multilingual, providing assistance in over 27 different languages. The company has a global client base and ensures traders can receive help in their preferred language via email, phone, or live chat. This 24/5 dedicated support in dozens of languages makes it convenient for clients from various regions to communicate with HFM’s support team and get the guidance they need.",,
What deposit methods does HFM accept?,"HFM accepts a variety of deposit methods. These include bank wire transfers, credit/debit cards, and alternative e-wallets (such as Neteller, Skrill, etc.) Each method has its own minimum (e.g. $50 for cards, $250 for wire transfers) and processing time (cards/e-wallets are near-instant). Importantly, HFM does not charge any deposit fees, so you receive the full amount you fund.",,
How can I fund my HFM trading account?,"HFM accepts a variety of deposit methods. These include bank wire transfers, credit/debit cards, and alternative e-wallets (such as Neteller, Skrill, etc.) Each method has its own minimum (e.g. $50 for cards, $250 for wire transfers) and processing time (cards/e-wallets are near-instant). Importantly, HFM does not charge any deposit fees hfeu.com , so you receive the full amount you fund.",,
Which payment options are available for HFM deposits?,"HFM accepts a variety of deposit methods. These include bank wire transfers, credit/debit cards, and alternative e-wallets (such as Neteller, Skrill, etc.) Each method has its own minimum (e.g. $50 for cards, $250 for wire transfers) and processing time (cards/e-wallets are near-instant). Importantly, HFM does not charge any deposit fees hfeu.com , so you receive the full amount you fund.",,
What withdrawal options does HFM offer?,"HFM supports withdrawals via bank wire transfer, credit/debit card, and e-wallets. Withdrawals are processed 24/7, typically taking a few business days for bank wires (depending on correspondent banks) and up to 10 minutes for cards/e-wallets. HFM itself charges no withdrawal fees (however, your bank may levy its standard fees on wire transfers). To withdraw, simply log into your client area and select “Fund Withdrawal.”",,
How do I withdraw funds from HFM?,"HFM supports withdrawals via bank wire transfer, credit/debit card, and e-wallets. Withdrawals are processed 24/7, typically taking a few business days for bank wires (depending on correspondent banks) and up to 10 minutes for cards/e-wallets. HFM itself charges no withdrawal fees (however, your bank may levy its standard fees on wire transfers). To withdraw, simply log into your client area and select “Fund Withdrawal.”",,
Which withdrawal methods can I use with HFM?,"HFM supports withdrawals via bank wire transfer, credit/debit card, and e-wallets. Withdrawals are processed 24/7, typically taking a few business days for bank wires (depending on correspondent banks) and up to 10 minutes for cards/e-wallets. HFM itself charges no withdrawal fees (however, your bank may levy its standard fees on wire transfers). To withdraw, simply log into your client area and select “Fund Withdrawal.”",,
How can I become a strategy provider on HFM?,"To become a Strategy Provider, you need to follow these steps:  Register with HFM.  Open a specific account as a Strategy Provider. Even if you already have an HFM trading account, you will need to open a new Copy Trading account.  Fund your account.  Start trading to showcase your skills, build a track record, and attract followers.  Requirements to Join as a Strategy Provider The primary requirements mentioned are:  You must register with HFM.  You must open a specific ""Strategy Provider"" or ""Copy Trading"" account.  You must fund this account with the required minimum deposit. The minimum initial deposit varies by account type:  Copy Trading Cent Account: $25 (2500 USc)  Copy Trading Premium Account: $100  Copy Trading Pro Account: $100  Once your account is set up and funded, you can begin trading to offer your strategies for others to copy.",,
What are the requirements to join HFM as a strategy provider?,"To become a Strategy Provider, you need to follow these steps:  Register with HFM.  Open a specific account as a Strategy Provider. Even if you already have an HFM trading account, you will need to open a new Copy Trading account.  Fund your account.  Start trading to showcase your skills, build a track record, and attract followers.  Requirements to Join as a Strategy Provider The primary requirements mentioned are:  You must register with HFM.  You must open a specific ""Strategy Provider"" or ""Copy Trading"" account.  You must fund this account with the required minimum deposit. The minimum initial deposit varies by account type:  Copy Trading Cent Account: $25 (2500 USc)  Copy Trading Premium Account: $100  Copy Trading Pro Account: $100  Once your account is set up and funded, you can begin trading to offer your strategies for others to copy.",,
How do I start offering strategies for copy trading with HFM?,"To become a Strategy Provider, you need to follow these steps:  Register with HFM.  Open a specific account as a Strategy Provider. Even if you already have an HFM trading account, you will need to open a new Copy Trading account.  Fund your account.  Start trading to showcase your skills, build a track record, and attract followers.  Requirements to Join as a Strategy Provider The primary requirements mentioned are:  You must register with HFM.  You must open a specific ""Strategy Provider"" or ""Copy Trading"" account.  You must fund this account with the required minimum deposit. The minimum initial deposit varies by account type:  Copy Trading Cent Account: $25 (2500 USc)  Copy Trading Premium Account: $100  Copy Trading Pro Account: $100  Once your account is set up and funded, you can begin trading to offer your strategies for others to copy.",,
What is the Premium Trader program?,"The Premium Trader program from HFM is a suite of Premium Trader Tools, which are advanced, institutional-quality add-ons available for the MT4 and MT5 platforms. These downloadable tools are available to all HFM clients with a live account. The benefits of using these tools include access to sophisticated trade execution and analysis (like the Trade Terminal), a personal trading assistant (the Alarm Manager), tools to view market sentiment (the Sentiment Trader), and advanced analysis instruments (like the Correlation Matrix), all designed to help you make more informed and confident trading decisions.",,
Who can user the Premium Trader Tools?,"The Premium Trader program from HFM is a suite of Premium Trader Tools, which are advanced, institutional-quality add-ons available for the MT4 and MT5 platforms. These downloadable tools are available to all HFM clients with a live account. The benefits of using these tools include access to sophisticated trade execution and analysis (like the Trade Terminal), a personal trading assistant (the Alarm Manager), tools to view market sentiment (the Sentiment Trader), and advanced analysis instruments (like the Correlation Matrix), all designed to help you make more informed and confident trading decisions.",,
what premium trader tools are available?,"the following Premium Trader Tools are available:  Trade Terminal: A professional trade execution and analysis tool.  Mini Terminal: An extension that displays a deal ticket in the context of a specific trading chart.  Connect: Provides a user-configurable news feed and economic calendar.  Sentiment Trader: Shows market sentiment based on real open positions.  Session Map: Offers a quick market overview through the world's key markets and time zones.  Alarm Manager: A personal trading assistant that can notify you of events and carry out automated actions.  Excel RTD: Puts real-time account, ticket, and price data into an Excel spreadsheet.  Market Manager: Provides control over symbol watch-lists and all account and order activity from one window.  Correlation Matrix: Shows the correlation between different markets on various time scales.  Correlation Trader: Allows you to compare the correlation between two symbols and trade emerging differences.  Tick Chart Trader: Displays various types of tick charts and allows for ultra-fast order entry.  MT4 & MT5 Indicator Package: A set of useful chart indicators, including pivot points, Renko bars, and a candle countdown.",,
What is Trade terminal?,"The Trade Terminal is a feature-rich professional tool designed to enhance your trade execution and analysis. Its key functionalities include precision trading, templates for your frequently used order entries, and analysis of your open positions. It also helps you manage your trades by offering automated scaling out from positions, allowing for a more controlled exit strategy.",,
How does trader terminal help with trade execution and analysis,"The Trade Terminal is a feature-rich professional tool designed to enhance your trade execution and analysis. Its key functionalities include precision trading, templates for your frequently used order entries, and analysis of your open positions. It also helps you manage your trades by offering automated scaling out from positions, allowing for a more controlled exit strategy.",,
Can you describe the main functionalities of the trade terminal? ,"The Trade Terminal is a feature-rich professional tool designed to enhance your trade execution and analysis. Its key functionalities include precision trading, templates for your frequently used order entries, and analysis of your open positions. It also helps you manage your trades by offering automated scaling out from positions, allowing for a more controlled exit strategy.",,
What is the difference between trade terminal and mini terminal?,"The Mini Terminal is an extension of the main Trade Terminal. Its specific purpose is to provide the same powerful deal ticket functionality but in a more compact format. The key difference is that instead of opening a separate window, the Mini Terminal displays the deal ticket directly in the context of a specific trading chart you are currently working on.",,
What is mini terminal?,"The Mini Terminal is an extension of the main Trade Terminal. Its specific purpose is to display the same deal ticket as the Trade Terminal, but in the context of a specific trading chart, rather than in a separate window.",,
What is the Connect tool,"The Connect tool is a component of the Premium Trader Tools suite designed to give you customizable market-news and economic-calendar feeds, plus quick access to key HFM services such as deposit functionality, educational materials and webinar registration. You can tailor which news feeds you see, add your own RSS sources in any language, set up filters for specific instruments (e.g., EUR/USD or gold) and create alerts that notify you when matching content appears. The tool updates automatically and does not require re-installation, making it a convenient way to stay informed and act on relevant market information.",,
what is connect,"The Connect tool is a component of the Premium Trader Tools suite designed to give you customizable market-news and economic-calendar feeds, plus quick access to key HFM services such as deposit functionality, educational materials and webinar registration. You can tailor which news feeds you see, add your own RSS sources in any language, set up filters for specific instruments (e.g., EUR/USD or gold) and create alerts that notify you when matching content appears. The tool updates automatically and does not require re-installation, making it a convenient way to stay informed and act on relevant market information.",,
What are the benefits of hfm connect,"The Connect tool is a component of the Premium Trader Tools suite designed to give you customizable market-news and economic-calendar feeds, plus quick access to key HFM services such as deposit functionality, educational materials and webinar registration. You can tailor which news feeds you see, add your own RSS sources in any language, set up filters for specific instruments (e.g., EUR/USD or gold) and create alerts that notify you when matching content appears. The tool updates automatically and does not require re-installation, making it a convenient way to stay informed and act on relevant market information.",,
What is sentiment trader,"The Sentiment Trader is part of HFM’s “Premium Trader Tools” suite and shows live market-sentiment data based on real-time open positions (long vs short) across instruments. It features a dashboard for multiple symbols and includes a chart where historic sentiment is plotted against price. You can customise the display (gauge, pie chart, line or candlestick), choose the timeframe for past data, view your open position alongside sentiment, and even place trades directly from the tool. Sentiment is gathered from multiple providers (for example via FX Blue Labs) and is meant to assist decision-making rather than guarantee outcomes.",,
can the sentiment trader display historical data?,"The Sentiment Trader is part of HFM’s “Premium Trader Tools” suite and shows live market-sentiment data based on real-time open positions (long vs short) across instruments. It features a dashboard for multiple symbols and includes a chart where historic sentiment is plotted against price. You can customise the display (gauge, pie chart, line or candlestick), choose the timeframe for past data, view your open position alongside sentiment, and even place trades directly from the tool. Sentiment is gathered from multiple providers (for example via FX Blue Labs) and is meant to assist decision-making rather than guarantee outcomes.",,
how does sentiment trader work?,"The Sentiment Trader is part of HFM’s “Premium Trader Tools” suite and shows live market-sentiment data based on real-time open positions (long vs short) across instruments. It features a dashboard for multiple symbols and includes a chart where historic sentiment is plotted against price. You can customise the display (gauge, pie chart, line or candlestick), choose the timeframe for past data, view your open position alongside sentiment, and even place trades directly from the tool. Sentiment is gathered from multiple providers (for example via FX Blue Labs) and is meant to assist decision-making rather than guarantee outcomes.",,
what is session map,"The Session Map is one of HFM’s Premium Trader Tools designed to give traders a clear visual overview of global market sessions in real time. It shows which financial centers (such as London, New York, Tokyo, and Sydney) are currently open or closed and highlights overlapping trading hours when market activity typically increases. The map also displays key economic events and relative price movements, helping traders quickly identify when volatility might rise. This allows for better timing of trades and improved awareness of global market dynamics throughout the trading day.",,
what are the benefits of session map for market overview,"The Session Map is one of HFM’s Premium Trader Tools designed to give traders a clear visual overview of global market sessions in real time. It shows which financial centers (such as London, New York, Tokyo, and Sydney) are currently open or closed and highlights overlapping trading hours when market activity typically increases. The map also displays key economic events and relative price movements, helping traders quickly identify when volatility might rise. This allows for better timing of trades and improved awareness of global market dynamics throughout the trading day.",,
what information is shown on the session map,"The Session Map is one of HFM’s Premium Trader Tools designed to give traders a clear visual overview of global market sessions in real time. It shows which financial centers (such as London, New York, Tokyo, and Sydney) are currently open or closed and highlights overlapping trading hours when market activity typically increases. The map also displays key economic events and relative price movements, helping traders quickly identify when volatility might rise. This allows for better timing of trades and improved awareness of global market dynamics throughout the trading day.",,
what is alarm manager ,"The Alarm Manager is part of HFM’s Premium Trader Tools suite that acts as a personal trading assistant by monitoring market and account events in real time. It allows traders to set up customized alerts for specific price levels, account metrics, news releases, or time-based triggers. The tool can send notifications through pop-ups, email, or SMS, and can also execute automated actions such as opening or closing positions when predefined conditions are met. This helps traders stay informed and react instantly without having to constantly monitor the platform.",,
Can you setup alarm manager to send notifications or open positions automatically? ,"The Alarm Manager is part of HFM’s Premium Trader Tools suite that acts as a personal trading assistant by monitoring market and account events in real time. It allows traders to set up customized alerts for specific price levels, account metrics, news releases, or time-based triggers. The tool can send notifications through pop-ups, email, or SMS, and can also execute automated actions such as opening or closing positions when predefined conditions are met. This helps traders stay informed and react instantly without having to constantly monitor the platform.",,
How does the Alarm Manager function as a personal trading assistant?,"The Alarm Manager is part of HFM’s Premium Trader Tools suite that acts as a personal trading assistant by monitoring market and account events in real time. It allows traders to set up customized alerts for specific price levels, account metrics, news releases, or time-based triggers. The tool can send notifications through pop-ups, email, or SMS, and can also execute automated actions such as opening or closing positions when predefined conditions are met. This helps traders stay informed and react instantly without having to constantly monitor the platform.",,
What is the Excel RTD tool?,"The Excel RTD tool is a component of HFM’s Premium Trader Tools that lets traders stream real-time account, ticket, and price data directly into Microsoft Excel without requiring programming skills. By using simple formulas, you can display live data such as bid/ask prices, account balance, equity, or open positions in a customized spreadsheet layout. In addition to monitoring, the RTD tool also supports sending trading commands directly from Excel, allowing you to open, close, or modify positions right from your spreadsheet. This makes it ideal for traders who want to analyze or automate trading using Excel’s powerful functions and interface.",,
How can I link real-time HFM account data to an Excel spreadsheet?,"The Excel RTD tool is a component of HFM’s Premium Trader Tools that lets traders stream real-time account, ticket, and price data directly into Microsoft Excel without requiring programming skills. By using simple formulas, you can display live data such as bid/ask prices, account balance, equity, or open positions in a customized spreadsheet layout. In addition to monitoring, the RTD tool also supports sending trading commands directly from Excel, allowing you to open, close, or modify positions right from your spreadsheet. This makes it ideal for traders who want to analyze or automate trading using Excel’s powerful functions and interface.",,
Does the Excel RTD tool allow for sending trading commands from Excel?,"The Excel RTD tool is a component of HFM’s Premium Trader Tools that lets traders stream real-time account, ticket, and price data directly into Microsoft Excel without requiring programming skills. By using simple formulas, you can display live data such as bid/ask prices, account balance, equity, or open positions in a customized spreadsheet layout. In addition to monitoring, the RTD tool also supports sending trading commands directly from Excel, allowing you to open, close, or modify positions right from your spreadsheet. This makes it ideal for traders who want to analyze or automate trading using Excel’s powerful functions and interface.",,
what is market manager ,"The Market Manager is part of HFM’s Premium Trader Tools suite and serves as a compact control panel for managing trades, monitoring market activity, and tracking account performance in real time. It allows traders to view live prices, open and close positions, modify existing orders, and manage pending trades directly from a single interface. The tool also provides quick access to charts, news, and market sentiment data, helping traders make faster, more informed decisions. With its streamlined layout, Market Manager simplifies trade execution and portfolio oversight without needing to switch between multiple windows.",,
Can you place and modify orders directly from the Market Manager?,"The Market Manager is part of HFM’s Premium Trader Tools suite and serves as a compact control panel for managing trades, monitoring market activity, and tracking account performance in real time. It allows traders to view live prices, open and close positions, modify existing orders, and manage pending trades directly from a single interface. The tool also provides quick access to charts, news, and market sentiment data, helping traders make faster, more informed decisions. With its streamlined layout, Market Manager simplifies trade execution and portfolio oversight without needing to switch between multiple windows.",,
What functions does market manager include?,"The Market Manager is part of HFM’s Premium Trader Tools suite and serves as a compact control panel for managing trades, monitoring market activity, and tracking account performance in real time. It allows traders to view live prices, open and close positions, modify existing orders, and manage pending trades directly from a single interface. The tool also provides quick access to charts, news, and market sentiment data, helping traders make faster, more informed decisions. With its streamlined layout, Market Manager simplifies trade execution and portfolio oversight without needing to switch between multiple windows.",,
what is correlation matrix?,"The Correlation Matrix is part of HFM’s Premium Trader Tools suite and displays the correlation strength between different trading instruments over various timeframes. It visually represents how closely price movements of different markets are related, showing positive correlations (moving in the same direction) or negative correlations (moving in opposite directions). Traders can use this information to manage risk, diversify portfolios, and avoid overexposure to similarly behaving instruments. By quickly identifying strong or weak correlations, the Correlation Matrix helps traders make more balanced and informed trading decisions.",,
What data does the Correlation Matrix show about different markets?,"The Correlation Matrix is part of HFM’s Premium Trader Tools suite and displays the correlation strength between different trading instruments over various timeframes. It visually represents how closely price movements of different markets are related, showing positive correlations (moving in the same direction) or negative correlations (moving in opposite directions). Traders can use this information to manage risk, diversify portfolios, and avoid overexposure to similarly behaving instruments. By quickly identifying strong or weak correlations, the Correlation Matrix helps traders make more balanced and informed trading decisions.",,
Can you explain the purpose of the Correlation Matrix tool?,"The Correlation Matrix is part of HFM’s Premium Trader Tools suite and displays the correlation strength between different trading instruments over various timeframes. It visually represents how closely price movements of different markets are related, showing positive correlations (moving in the same direction) or negative correlations (moving in opposite directions). Traders can use this information to manage risk, diversify portfolios, and avoid overexposure to similarly behaving instruments. By quickly identifying strong or weak correlations, the Correlation Matrix helps traders make more balanced and informed trading decisions.",,
